
Shrek,2001,PG,18 May 2001,90 min,"Animation, Adventure, Comedy","Andrew Adamson, Vicky Jenson","William Steig, Ted Elliott, Terry Rossio","Mike Myers, Eddie Murphy, Cameron Diaz","A mean lord exiles fairytale creatures to the swamp of a grumpy ogre, who must go on a quest and rescue a princess for the lord in order to get his land back.",English,United States,Won 1 Oscar. 40 wins & 60 nominations total,https://m.media-amazon.com/images/M/MV5BN2FkMTRkNTUtYTI0NC00ZjI4LWI5MzUtMDFmOGY0NmU2OGY1XkEyXkFqcGc@._V1_SX300.jpg,"[{'Source': 'Internet Movie Database', 'Value': '7.9/10'}, {'Source': 'Rotten Tomatoes', 'Value': '88%'}, {'Source': 'Metacritic', 'Value': '84/100'}]",84,7.9,"779,468",tt0126029,movie,N/A,"$268,698,241",N/A,N/A,True,
Shrek 2,2004,PG,19 May 2004,93 min,"Animation, Adventure, Comedy","Andrew Adamson, Kelly Asbury, Conrad Vernon","William Steig, Andrew Adamson, Joe Stillman","Mike Myers, Eddie Murphy, Cameron Diaz","Shrek and Fiona travel to the Kingdom of Far Far Away, where Fiona's parents are King and Queen, to celebrate their marriage. When they arrive, they find they are not as welcome as they thought they would be.",English,United States,Nominated for 2 Oscars. 18 wins & 52 nominations total,https://m.media-amazon.com/images/M/MV5BMzNmNjQ1NmUtNzhiZS00YWE2LTg4N2ItZTA2ODdmOTMwOTQ1XkEyXkFqcGc@._V1_SX300.jpg,"[{'Source': 'Internet Movie Database', 'Value': '7.4/10'}, {'Source': 'Rotten Tomatoes', 'Value': '89%'}, {'Source': 'Metacritic', 'Value': '75/100'}]",75,7.4,"535,718",tt0298148,movie,N/A,"$444,978,202",N/A,N/A,True,
Harry Potter and the Deathly Hallows: Part 2,2011,PG-13,15 Jul 2011,130 min,"Adventure, Family, Fantasy",David Yates,"Steve Kloves, J.K. Rowling","Daniel Radcliffe, Emma Watson, Rupert Grint","As the battle between the forces of good and evil in the wizarding world escalates, Harry Potter draws ever closer to his final confrontation with Voldemort.","English, Latin","United Kingdom, United States",Nominated for 3 Oscars. 49 wins & 96 nominations total,https://m.media-amazon.com/images/M/MV5BOTA1Mzc2N2ItZWRiNS00MjQzLTlmZDQtMjU0NmY1YWRkMGQ4XkEyXkFqcGc@._V1_SX300.jpg,"[{'Source': 'Internet Movie Database', 'Value': '8.1/10'}, {'Source': 'Rotten Tomatoes', 'Value': '96%'}, {'Source': 'Metacritic', 'Value': '85/100'}]",85,8.1,"1,000,668",tt1201607,movie,N/A,"$381,447,587",N/A,N/A,True,
Game of Thrones,2011–2019,TV-MA,17 Apr 2011,57 min,"Action, Adventure, Drama",N/A,"David Benioff, D.B. Weiss","Emilia Clarke, Peter Dinklage, Kit Harington","Nine noble families fight for control over the lands of Westeros, while an ancient enemy returns after being dormant for millennia.",English,"United States, United Kingdom",Won 59 Primetime Emmys. 395 wins & 655 nominations total,https://m.media-amazon.com/images/M/MV5BMTNhMDJmNmYtNDQ5OS00ODdlLWE0ZDAtZTgyYTIwNDY3OTU3XkEyXkFqcGc@._V1_SX300.jpg,"[{'Source': 'Internet Movie Database', 'Value': '9.2/10'}]",N/A,9.2,"2,457,210",tt0944947,series,,,,,True,8
The Office,2005–2013,TV-14,24 Mar 2005,22 min,Comedy,N/A,"Greg Daniels, Ricky Gervais, Stephen Merchant","Steve Carell, Jenna Fischer, John Krasinski","A mockumentary on a group of typical office workers, where the workday consists of ego clashes, inappropriate behavior, tedium and romance.","English, Spanish, German, French",United States,Won 5 Primetime Emmys. 59 wins & 211 nominations total,https://m.media-amazon.com/images/M/MV5BZjQwYzBlYzUtZjhhOS00ZDQ0LWE0NzAtYTk4MjgzZTNkZWEzXkEyXkFqcGc@._V1_SX300.jpg,"[{'Source': 'Internet Movie Database', 'Value': '9.0/10'}]",N/A,9.0,"783,728",tt0386676,series,,,,,True,9
Fullmetal Alchemist: Brotherhood,2009–2010,TV-14,09 Apr 2009,54S min,"Animation, Action, Adventure",N/A,Hiromu Arakawa,"Kent Williams, Iemasa Kayumi, Vic Mignogna",Two brothers search for a Philosopher's Stone after an attempt to revive their deceased mother goes awry and leaves them in damaged physical forms.,"Japanese, English, French, German, Portuguese, Spanish",Japan,3 wins & 4 nominations total,https://m.media-amazon.com/images/M/MV5BMzNiODA5NjYtYWExZS00OTc4LTg3N2ItYWYwYTUyYmM5MWViXkEyXkFqcGc@._V1_SX300.jpg,"[{'Source': 'Internet Movie Database', 'Value': '9.1/10'}]",N/A,9.1,"225,167",tt1355642,series,,,,,True,1
Avatar: The Last Airbender,2005–2008,TV-Y7-FV,21 Feb 2005,23 min,"Animation, Action, Adventure",N/A,"Michael Dante DiMartino, Bryan Konietzko","Dee Bradley Baker, Zach Tyler Eisen, Mae Whitman","In a war-torn world of elemental powers, a young boy reawakens to undertake a dangerous mystic quest to fulfill his destiny as the Avatar, and bring peace to the world.",English,"United States, South Korea",Won 1 Primetime Emmy. 9 wins & 7 nominations total,https://m.media-amazon.com/images/M/MV5BMDMwMThjYWYtY2Q2OS00OGM2LTlkODQtNDJlZTZmMjAyYmFhXkEyXkFqcGc@._V1_SX300.jpg,"[{'Source': 'Internet Movie Database', 'Value': '9.3/10'}]",N/A,9.3,"408,598",tt0417299,series,,,,,True,3
Shrek,2001,PG,18 May 2001,90 min,"Animation, Adventure, Comedy","Andrew Adamson, Vicky Jenson","William Steig, Ted Elliott, Terry Rossio","Mike Myers, Eddie Murphy, Cameron Diaz","A mean lord exiles fairytale creatures to the swamp of a grumpy ogre, who must go on a quest and rescue a princess for the lord in order to get his land back.",English,United States,Won 1 Oscar. 40 wins & 60 nominations total,https://m.media-amazon.com/images/M/MV5BN2FkMTRkNTUtYTI0NC00ZjI4LWI5MzUtMDFmOGY0NmU2OGY1XkEyXkFqcGc@._V1_SX300.jpg,"[{'Source': 'Internet Movie Database', 'Value': '7.9/10'}, {'Source': 'Rotten Tomatoes', 'Value': '88%'}, {'Source': 'Metacritic', 'Value': '84/100'}]",84,7.9,"779,468",tt0126029,movie,N/A,"$268,698,241",N/A,N/A,True,
Shrek 2,2004,PG,19 May 2004,93 min,"Animation, Adventure, Comedy","Andrew Adamson, Kelly Asbury, Conrad Vernon","William Steig, Andrew Adamson, Joe Stillman","Mike Myers, Eddie Murphy, Cameron Diaz","Shrek and Fiona travel to the Kingdom of Far Far Away, where Fiona's parents are King and Queen, to celebrate their marriage. When they arrive, they find they are not as welcome as they thought they would be.",English,United States,Nominated for 2 Oscars. 18 wins & 52 nominations total,https://m.media-amazon.com/images/M/MV5BMzNmNjQ1NmUtNzhiZS00YWE2LTg4N2ItZTA2ODdmOTMwOTQ1XkEyXkFqcGc@._V1_SX300.jpg,"[{'Source': 'Internet Movie Database', 'Value': '7.4/10'}, {'Source': 'Rotten Tomatoes', 'Value': '89%'}, {'Source': 'Metacritic', 'Value': '75/100'}]",75,7.4,"535,718",tt0298148,movie,N/A,"$444,978,202",N/A,N/A,True,
Harry Potter and the Deathly Hallows: Part 2,2011,PG-13,15 Jul 2011,130 min,"Adventure, Family, Fantasy",David Yates,"Steve Kloves, J.K. Rowling","Daniel Radcliffe, Emma Watson, Rupert Grint","As the battle between the forces of good and evil in the wizarding world escalates, Harry Potter draws ever closer to his final confrontation with Voldemort.","English, Latin","United Kingdom, United States",Nominated for 3 Oscars. 49 wins & 96 nominations total,https://m.media-amazon.com/images/M/MV5BOTA1Mzc2N2ItZWRiNS00MjQzLTlmZDQtMjU0NmY1YWRkMGQ4XkEyXkFqcGc@._V1_SX300.jpg,"[{'Source': 'Internet Movie Database', 'Value': '8.1/10'}, {'Source': 'Rotten Tomatoes', 'Value': '96%'}, {'Source': 'Metacritic', 'Value': '85/100'}]",85,8.1,"1,000,668",tt1201607,movie,N/A,"$381,447,587",N/A,N/A,True,
Game of Thrones,2011–2019,TV-MA,17 Apr 2011,57 min,"Action, Adventure, Drama",N/A,"David Benioff, D.B. Weiss","Emilia Clarke, Peter Dinklage, Kit Harington","Nine noble families fight for control over the lands of Westeros, while an ancient enemy returns after being dormant for millennia.",English,"United States, United Kingdom",Won 59 Primetime Emmys. 395 wins & 655 nominations total,https://m.media-amazon.com/images/M/MV5BMTNhMDJmNmYtNDQ5OS00ODdlLWE0ZDAtZTgyYTIwNDY3OTU3XkEyXkFqcGc@._V1_SX300.jpg,"[{'Source': 'Internet Movie Database', 'Value': '9.2/10'}]",N/A,9.2,"2,457,210",tt0944947,series,,,,,True,8
The Office,2005–2013,TV-14,24 Mar 2005,22 min,Comedy,N/A,"Greg Daniels, Ricky Gervais, Stephen Merchant","Steve Carell, Jenna Fischer, John Krasinski","A mockumentary on a group of typical office workers, where the workday consists of ego clashes, inappropriate behavior, tedium and romance.","English, Spanish, German, French",United States,Won 5 Primetime Emmys. 59 wins & 211 nominations total,https://m.media-amazon.com/images/M/MV5BZjQwYzBlYzUtZjhhOS00ZDQ0LWE0NzAtYTk4MjgzZTNkZWEzXkEyXkFqcGc@._V1_SX300.jpg,"[{'Source': 'Internet Movie Database', 'Value': '9.0/10'}]",N/A,9.0,"783,728",tt0386676,series,,,,,True,9
Fullmetal Alchemist: Brotherhood,2009–2010,TV-14,09 Apr 2009,54S min,"Animation, Action, Adventure",N/A,Hiromu Arakawa,"Kent Williams, Iemasa Kayumi, Vic Mignogna",Two brothers search for a Philosopher's Stone after an attempt to revive their deceased mother goes awry and leaves them in damaged physical forms.,"Japanese, English, French, German, Portuguese, Spanish",Japan,3 wins & 4 nominations total,https://m.media-amazon.com/images/M/MV5BMzNiODA5NjYtYWExZS00OTc4LTg3N2ItYWYwYTUyYmM5MWViXkEyXkFqcGc@._V1_SX300.jpg,"[{'Source': 'Internet Movie Database', 'Value': '9.1/10'}]",N/A,9.1,"225,167",tt1355642,series,,,,,True,1
Avatar: The Last Airbender,2005–2008,TV-Y7-FV,21 Feb 2005,23 min,"Animation, Action, Adventure",N/A,"Michael Dante DiMartino, Bryan Konietzko","Dee Bradley Baker, Zach Tyler Eisen, Mae Whitman","In a war-torn world of elemental powers, a young boy reawakens to undertake a dangerous mystic quest to fulfill his destiny as the Avatar, and bring peace to the world.",English,"United States, South Korea",Won 1 Primetime Emmy. 9 wins & 7 nominations total,https://m.media-amazon.com/images/M/MV5BMDMwMThjYWYtY2Q2OS00OGM2LTlkODQtNDJlZTZmMjAyYmFhXkEyXkFqcGc@._V1_SX300.jpg,"[{'Source': 'Internet Movie Database', 'Value': '9.3/10'}]",N/A,9.3,"408,598",tt0417299,series,,,,,True,3
Iron Man,2008,PG-13,02 May 2008,126 min,"Action, Adventure, Sci-Fi",Jon Favreau,"Mark Fergus, Hawk Ostby, Art Marcum","Robert Downey Jr., Gwyneth Paltrow, Terrence Howard","After being held captive in an Afghan cave, billionaire engineer Tony Stark creates a unique weaponized suit of armor to fight evil.","English, Persian, Urdu, Arabic, Kurdish, Hindi, Hungarian","United States, Canada",Nominated for 2 Oscars. 24 wins & 73 nominations total,https://m.media-amazon.com/images/M/MV5BMTczNTI2ODUwOF5BMl5BanBnXkFtZTcwMTU0NTIzMw@@._V1_SX300.jpg,"[{'Source': 'Internet Movie Database', 'Value': '7.9/10'}, {'Source': 'Rotten Tomatoes', 'Value': '94%'}, {'Source': 'Metacritic', 'Value': '79/100'}]",79,7.9,"1,183,300",tt0371746,movie,N/A,"$319,034,126",N/A,N/A,True,
Iron Man 2,2010,PG-13,07 May 2010,124 min,"Action, Sci-Fi",Jon Favreau,"Justin Theroux, Stan Lee, Don Heck","Robert Downey Jr., Mickey Rourke, Gwyneth Paltrow","With the world now aware of his identity as Iron Man, Tony Stark must contend with both his declining health and a vengeful mad man with ties to his father's legacy.","English, French, Russian",United States,Nominated for 1 Oscar. 7 wins & 45 nominations total,https://m.media-amazon.com/images/M/MV5BYWYyOGQzOGYtMGQ1My00ZWYxLTgzZjktZWYzN2IwYjkxYzM0XkEyXkFqcGc@._V1_SX300.jpg,"[{'Source': 'Internet Movie Database', 'Value': '6.9/10'}, {'Source': 'Rotten Tomatoes', 'Value': '72%'}, {'Source': 'Metacritic', 'Value': '57/100'}]",57,6.9,"909,600",tt1228705,movie,N/A,"$312,433,331",N/A,N/A,True,
Thor,2011,PG-13,06 May 2011,115 min,"Action, Fantasy",Kenneth Branagh,"Ashley E. Miller, Zack Stentz, Don Payne","Chris Hemsworth, Anthony Hopkins, Natalie Portman","The powerful but arrogant god Thor is cast out of Asgard to live amongst humans in Midgard (Earth), where he soon becomes one of their finest defenders.",English,United States,5 wins & 30 nominations total,https://m.media-amazon.com/images/M/MV5BNjRhNGZjZjEtYTQzYS00OWUxLThjNGEtMTIwMTE2ZDFlZTZkXkEyXkFqcGc@._V1_SX300.jpg,"[{'Source': 'Internet Movie Database', 'Value': '7.0/10'}, {'Source': 'Rotten Tomatoes', 'Value': '77%'}, {'Source': 'Metacritic', 'Value': '57/100'}]",57,7.0,"936,720",tt0800369,movie,N/A,"$181,030,624",N/A,N/A,True,
Captain America: The First Avenger,2011,PG-13,22 Jul 2011,124 min,"Action, Adventure, Sci-Fi",Joe Johnston,"Christopher Markus, Stephen McFeely, Joe Simon","Chris Evans, Hugo Weaving, Samuel L. Jackson","Steve Rogers, a rejected military soldier, transforms into Captain America after taking a dose of a ""Super-Soldier serum"". But being Captain America comes at a price as he attempts to take down a warmonger and a terrorist organiza...","English, Norwegian, French",United States,4 wins & 50 nominations total,https://m.media-amazon.com/images/M/MV5BNzUyM2YyY2MtNzNlMS00MWU5LTgxNjAtNzZlNmI2NjU2NDZlXkEyXkFqcGc@._V1_SX300.jpg,"[{'Source': 'Internet Movie Database', 'Value': '6.9/10'}, {'Source': 'Rotten Tomatoes', 'Value': '80%'}, {'Source': 'Metacritic', 'Value': '66/100'}]",66,6.9,"936,774",tt0458339,movie,N/A,"$176,654,505",N/A,N/A,True,
The Avengers,2012,PG-13,04 May 2012,143 min,"Action, Sci-Fi",Joss Whedon,"Joss Whedon, Zak Penn","Robert Downey Jr., Chris Evans, Scarlett Johansson",Earth's mightiest heroes must come together and learn to fight as a team if they are going to stop the mischievous Loki and his alien army from enslaving humanity.,"English, Russian",United States,Nominated for 1 Oscar. 39 wins & 81 nominations total,https://m.media-amazon.com/images/M/MV5BNGE0YTVjNzUtNzJjOS00NGNlLTgxMzctZTY4YTE1Y2Y1ZTU4XkEyXkFqcGc@._V1_SX300.jpg,"[{'Source': 'Internet Movie Database', 'Value': '8.0/10'}, {'Source': 'Rotten Tomatoes', 'Value': '91%'}, {'Source': 'Metacritic', 'Value': '69/100'}]",69,8.0,"1,516,933",tt0848228,movie,N/A,"$623,357,910",N/A,N/A,True,
Iron Man 3,2013,PG-13,03 May 2013,130 min,"Action, Adventure, Sci-Fi",Shane Black,"Drew Pearce, Shane Black, Stan Lee","Robert Downey Jr., Guy Pearce, Gwyneth Paltrow","When Tony Stark's world is torn apart by a formidable terrorist called the Mandarin, he starts an odyssey of rebuilding and retribution.",English,United States,Nominated for 1 Oscar. 20 wins & 63 nominations total,https://m.media-amazon.com/images/M/MV5BMjIzMzAzMjQyM15BMl5BanBnXkFtZTcwNzM2NjcyOQ@@._V1_SX300.jpg,"[{'Source': 'Internet Movie Database', 'Value': '7.1/10'}, {'Source': 'Rotten Tomatoes', 'Value': '79%'}, {'Source': 'Metacritic', 'Value': '62/100'}]",62,7.1,"937,973",tt1300854,movie,N/A,"$409,013,994",N/A,N/A,True,
Thor: The Dark World,2013,PG-13,08 Nov 2013,112 min,"Action, Adventure, Fantasy",Alan Taylor,"Christopher L. Yost, Christopher Markus, Stephen McFeely","Chris Hemsworth, Natalie Portman, Tom Hiddleston","When the Dark Elves attempt to plunge the universe into darkness, Thor must embark on a perilous and personal journey that will reunite him with doctor Jane Foster.",English,United States,4 wins & 21 nominations total,https://m.media-amazon.com/images/M/MV5BMTQyNzAwOTUxOF5BMl5BanBnXkFtZTcwMTE0OTc5OQ@@._V1_SX300.jpg,"[{'Source': 'Internet Movie Database', 'Value': '6.7/10'}, {'Source': 'Rotten Tomatoes', 'Value': '67%'}, {'Source': 'Metacritic', 'Value': '54/100'}]",54,6.7,"756,567",tt1981115,movie,N/A,"$206,362,140",N/A,N/A,True,
Captain America: The Winter Soldier,2014,PG-13,04 Apr 2014,136 min,"Action, Adventure, Sci-Fi","Anthony Russo, Joe Russo","Christopher Markus, Stephen McFeely, Joe Simon","Chris Evans, Samuel L. Jackson, Scarlett Johansson","As Steve Rogers struggles to embrace his role in the modern world, he teams up with a fellow Avenger and S.H.I.E.L.D agent, Black Widow, to battle a new threat from history: an assassin known as the Winter Soldier.","English, French",United States,Nominated for 1 Oscar. 5 wins & 52 nominations total,https://m.media-amazon.com/images/M/MV5BNWY1NjFmNDItZDhmOC00NjI1LWE0ZDItMTM0MjBjZThiOTQ2XkEyXkFqcGc@._V1_SX300.jpg,"[{'Source': 'Internet Movie Database', 'Value': '7.7/10'}, {'Source': 'Rotten Tomatoes', 'Value': '90%'}, {'Source': 'Metacritic', 'Value': '70/100'}]",70,7.7,"942,182",tt1843866,movie,N/A,"$259,766,572",N/A,N/A,True,
Guardians of the Galaxy,2014,PG-13,01 Aug 2014,121 min,"Action, Adventure, Comedy",James Gunn,"James Gunn, Nicole Perlman, Dan Abnett","Chris Pratt, Vin Diesel, Bradley Cooper",A group of intergalactic criminals must pull together to stop a fanatical warrior with plans to purge the universe.,English,"United States, United Kingdom",Nominated for 2 Oscars. 52 wins & 103 nominations total,https://m.media-amazon.com/images/M/MV5BM2ZmNjQ2MzAtNDlhNi00MmQyLWJhZDMtNmJiMjFlOWY4MzcxXkEyXkFqcGc@._V1_SX300.jpg,"[{'Source': 'Internet Movie Database', 'Value': '8.0/10'}, {'Source': 'Rotten Tomatoes', 'Value': '92%'}, {'Source': 'Metacritic', 'Value': '76/100'}]",76,8.0,"1,325,843",tt2015381,movie,N/A,"$333,718,600",N/A,N/A,True,
Avengers: Age of Ultron,2015,PG-13,01 May 2015,141 min,"Action, Adventure, Sci-Fi",Joss Whedon,"Joss Whedon, Stan Lee, Jack Kirby","Robert Downey Jr., Chris Evans, Mark Ruffalo","When Tony Stark and Bruce Banner try to jump-start a dormant peacekeeping program called Ultron, things go horribly wrong and it's up to Earth's mightiest heroes to stop the villainous Ultron from enacting his terrible plan.","English, Korean",United States,8 wins & 52 nominations total,https://m.media-amazon.com/images/M/MV5BODBhYTg1NGQtNGVmNS00ZTdiLThjYTYtZDFkNzRiNTZmNDZjXkEyXkFqcGc@._V1_SX300.jpg,"[{'Source': 'Internet Movie Database', 'Value': '7.3/10'}, {'Source': 'Rotten Tomatoes', 'Value': '76%'}, {'Source': 'Metacritic', 'Value': '66/100'}]",66,7.3,"959,787",tt2395427,movie,N/A,"$459,005,868",N/A,N/A,True,
Ant-Man,2015,PG-13,17 Jul 2015,117 min,"Action, Comedy, Sci-Fi",Peyton Reed,"Edgar Wright, Joe Cornish, Adam McKay","Paul Rudd, Michael Douglas, Corey Stoll","Armed with a super-suit with the astonishing ability to shrink in scale but increase in strength, cat burglar Scott Lang must embrace his inner hero and help his mentor, Dr. Hank Pym, pull off a plan that will save the world.",English,United States,Nominated for 1 BAFTA Award4 wins & 34 nominations total,https://m.media-amazon.com/images/M/MV5BMjM2NTQ5Mzc2M15BMl5BanBnXkFtZTgwNTcxMDI2NTE@._V1_SX300.jpg,"[{'Source': 'Internet Movie Database', 'Value': '7.2/10'}, {'Source': 'Rotten Tomatoes', 'Value': '83%'}, {'Source': 'Metacritic', 'Value': '64/100'}]",64,7.2,"753,860",tt0478970,movie,N/A,"$180,202,163",N/A,N/A,True,
Captain America: Civil War,2016,PG-13,06 May 2016,147 min,"Action, Sci-Fi","Anthony Russo, Joe Russo","Christopher Markus, Stephen McFeely, Joe Simon","Chris Evans, Robert Downey Jr., Scarlett Johansson",Political involvement in the Avengers' affairs causes a rift between Captain America and Iron Man.,"English, German, Xhosa, Russian, Romanian","United States, Germany, Puerto Rico",16 wins & 73 nominations total,https://m.media-amazon.com/images/M/MV5BMjQ0MTgyNjAxMV5BMl5BanBnXkFtZTgwNjUzMDkyODE@._V1_SX300.jpg,"[{'Source': 'Internet Movie Database', 'Value': '7.8/10'}, {'Source': 'Rotten Tomatoes', 'Value': '90%'}, {'Source': 'Metacritic', 'Value': '75/100'}]",75,7.8,"893,858",tt3498820,movie,N/A,"$408,084,349",N/A,N/A,True,
Doctor Strange,2016,PG-13,04 Nov 2016,115 min,"Action, Adventure, Fantasy",Scott Derrickson,"Jon Spaihts, Scott Derrickson, C. Robert Cargill","Benedict Cumberbatch, Chiwetel Ejiofor, Rachel McAdams","While on a journey of physical and spiritual healing, a brilliant neurosurgeon is drawn into the world of the mystic arts.",English,"United States, Hong Kong, Nepal",Nominated for 1 Oscar. 21 wins & 68 nominations total,https://m.media-amazon.com/images/M/MV5BNjgwNzAzNjk1Nl5BMl5BanBnXkFtZTgwMzQ2NjI1OTE@._V1_SX300.jpg,"[{'Source': 'Internet Movie Database', 'Value': '7.5/10'}, {'Source': 'Rotten Tomatoes', 'Value': '89%'}, {'Source': 'Metacritic', 'Value': '72/100'}]",72,7.5,"845,476",tt1211837,movie,N/A,"$232,641,920",N/A,N/A,True,
Guardians of the Galaxy Vol. 2,2017,PG-13,05 May 2017,136 min,"Action, Adventure, Comedy",James Gunn,"James Gunn, Dan Abnett, Andy Lanning","Chris Pratt, Zoe Saldaña, Dave Bautista","The Guardians struggle to keep together as a team while dealing with their personal family issues, notably Star-Lord's encounter with his father, the ambitious celestial being Ego.",English,United States,Nominated for 1 Oscar. 15 wins & 60 nominations total,https://m.media-amazon.com/images/M/MV5BNWE5MGI3MDctMmU5Ni00YzI2LWEzMTQtZGIyZDA5MzQzNDBhXkEyXkFqcGc@._V1_SX300.jpg,"[{'Source': 'Internet Movie Database', 'Value': '7.6/10'}, {'Source': 'Rotten Tomatoes', 'Value': '85%'}, {'Source': 'Metacritic', 'Value': '67/100'}]",67,7.6,"802,014",tt3896198,movie,N/A,"$389,813,101",N/A,N/A,True,
Spider-Man: Homecoming,2017,PG-13,07 Jul 2017,133 min,"Action, Adventure, Sci-Fi",Jon Watts,"Jonathan Goldstein, John Francis Daley, Jon Watts","Tom Holland, Michael Keaton, Robert Downey Jr.",Peter Parker tries to stop Adrian 'The Vulture' Toomes from selling weapons made with advanced Chitauri technology while trying to balance his life as an ordinary high school student.,"English, Spanish",United States,8 wins & 10 nominations total,https://m.media-amazon.com/images/M/MV5BODY2MTAzOTQ4M15BMl5BanBnXkFtZTgwNzg5MTE0MjI@._V1_SX300.jpg,"[{'Source': 'Internet Movie Database', 'Value': '7.4/10'}, {'Source': 'Rotten Tomatoes', 'Value': '92%'}, {'Source': 'Metacritic', 'Value': '73/100'}]",73,7.4,"760,911",tt2250912,movie,N/A,"$334,952,829",N/A,N/A,True,
Thor: Ragnarok,2017,PG-13,03 Nov 2017,130 min,"Action, Adventure, Comedy",Taika Waititi,"Eric Pearson, Craig Kyle, Christopher L. Yost","Chris Hemsworth, Tom Hiddleston, Cate Blanchett","Imprisoned on the planet Sakaar, Thor must race against time to return to Asgard and stop Ragnarök, the destruction of his world, at the hands of the powerful and ruthless villain Hela.",English,United States,6 wins & 50 nominations total,https://m.media-amazon.com/images/M/MV5BMjMyNDkzMzI1OF5BMl5BanBnXkFtZTgwODcxODg5MjI@._V1_SX300.jpg,"[{'Source': 'Internet Movie Database', 'Value': '7.9/10'}, {'Source': 'Rotten Tomatoes', 'Value': '93%'}, {'Source': 'Metacritic', 'Value': '74/100'}]",74,7.9,"858,156",tt3501632,movie,N/A,"$315,058,289",N/A,N/A,True,
Black Panther,2018,PG-13,16 Feb 2018,134 min,"Action, Adventure, Sci-Fi",Ryan Coogler,"Ryan Coogler, Joe Robert Cole, Stan Lee","Chadwick Boseman, Michael B. Jordan, Lupita Nyong'o","T'Challa, heir to the hidden but advanced kingdom of Wakanda, must step forward to lead his people into a new future and must confront a challenger from his country's past.","English, Swahili, Nama, Xhosa, Korean",United States,Won 3 Oscars. 124 wins & 289 nominations total,https://m.media-amazon.com/images/M/MV5BMTg1MTY2MjYzNV5BMl5BanBnXkFtZTgwMTc4NTMwNDI@._V1_SX300.jpg,"[{'Source': 'Internet Movie Database', 'Value': '7.3/10'}, {'Source': 'Rotten Tomatoes', 'Value': '96%'}, {'Source': 'Metacritic', 'Value': '88/100'}]",88,7.3,"879,347",tt1825683,movie,N/A,"$700,426,566",N/A,N/A,True,
Avengers: Infinity War,2018,PG-13,27 Apr 2018,149 min,"Action, Adventure, Sci-Fi","Anthony Russo, Joe Russo","Christopher Markus, Stephen McFeely, Stan Lee","Robert Downey Jr., Chris Hemsworth, Mark Ruffalo",The Avengers and their allies must be willing to sacrifice all in an attempt to defeat the powerful Thanos before his blitz of devastation and ruin puts an end to the universe.,English,"United States, Norway",Nominated for 1 Oscar. 48 wins & 80 nominations total,https://m.media-amazon.com/images/M/MV5BMjMxNjY2MDU1OV5BMl5BanBnXkFtZTgwNzY1MTUwNTM@._V1_SX300.jpg,"[{'Source': 'Internet Movie Database', 'Value': '8.4/10'}, {'Source': 'Rotten Tomatoes', 'Value': '85%'}, {'Source': 'Metacritic', 'Value': '68/100'}]",68,8.4,"1,301,790",tt4154756,movie,N/A,"$678,815,482",N/A,N/A,True,
Ant-Man and the Wasp,2018,PG-13,06 Jul 2018,118 min,"Action, Adventure, Comedy",Peyton Reed,"Chris McKenna, Erik Sommers, Paul Rudd","Paul Rudd, Evangeline Lilly, Michael Peña","As Scott Lang balances being both a superhero and a father, Hope van Dyne and Dr. Hank Pym present an urgent new mission that finds the Ant-Man fighting alongside The Wasp to uncover secrets from their past.","English, Spanish, French","United States, Canada",2 wins & 21 nominations total,https://m.media-amazon.com/images/M/MV5BODVkY2ZmZTAtYzFhMi00YzZlLWE2YWMtMDBiYjY2OTU4ZWM0XkEyXkFqcGc@._V1_SX300.jpg,"[{'Source': 'Internet Movie Database', 'Value': '7.0/10'}, {'Source': 'Rotten Tomatoes', 'Value': '87%'}, {'Source': 'Metacritic', 'Value': '70/100'}]",70,7.0,"474,767",tt5095030,movie,N/A,"$216,648,740",N/A,N/A,True,
Captain Marvel,2019,PG-13,08 Mar 2019,123 min,"Action, Adventure, Sci-Fi","Anna Boden, Ryan Fleck","Anna Boden, Ryan Fleck, Geneva Robertson-Dworet","Brie Larson, Samuel L. Jackson, Ben Mendelsohn",Carol Danvers becomes one of the universe's most powerful heroes when Earth is caught in the middle of a galactic war between two alien races.,English,"United States, Australia",10 wins & 56 nominations total,https://m.media-amazon.com/images/M/MV5BZDI1NGU2ODAtNzBiNy00MWY5LWIyMGEtZjUxZjUwZmZiNjBlXkEyXkFqcGc@._V1_SX300.jpg,"[{'Source': 'Internet Movie Database', 'Value': '6.8/10'}, {'Source': 'Rotten Tomatoes', 'Value': '79%'}, {'Source': 'Metacritic', 'Value': '64/100'}]",64,6.8,"634,777",tt4154664,movie,N/A,"$426,829,839",N/A,N/A,True,
Avengers: Endgame,2019,PG-13,26 Apr 2019,181 min,"Action, Adventure, Sci-Fi","Anthony Russo, Joe Russo","Christopher Markus, Stephen McFeely, Stan Lee","Robert Downey Jr., Chris Evans, Mark Ruffalo","After the devastating events of Avengers: Infinity War (2018), the universe is in ruins. With the help of remaining allies, the Avengers assemble once more in order to reverse Thanos' actions and restore balance to the universe.","English, Japanese, Xhosa, German",United States,Nominated for 1 Oscar. 70 wins & 132 nominations total,https://m.media-amazon.com/images/M/MV5BMTc5MDE2ODcwNV5BMl5BanBnXkFtZTgwMzI2NzQ2NzM@._V1_SX300.jpg,"[{'Source': 'Internet Movie Database', 'Value': '8.4/10'}, {'Source': 'Rotten Tomatoes', 'Value': '94%'}, {'Source': 'Metacritic', 'Value': '78/100'}]",78,8.4,"1,373,635",tt4154796,movie,N/A,"$858,373,000",N/A,N/A,True,
