
Onward,2020,PG,06 Mar 2020,102 min,"Animation, Adventure, Comedy",Dan Scanlon,"Dan Scanlon, Keith Bunin, Jason Headley","Tom Holland, Chris Pratt, Julia Louis-Dreyfus","Teenage elf brothers Ian and Barley embark on a magical quest to spend one more day with their late father. Like any good adventure, their journey is filled with cryptic maps, impossible obstacles and unimaginable discoveries.",English,"United States, Japan",Nominated for 1 Oscar. 4 wins & 64 nominations total,https://m.media-amazon.com/images/M/MV5BODYyM2I0YTItODA2MC00NDc0LTgyZmEtODM1MWQwZmY4YzY4XkEyXkFqcGc@._V1_SX300.jpg,"[{'Source': 'Internet Movie Database', 'Value': '7.4/10'}, {'Source': 'Rotten Tomatoes', 'Value': '88%'}, {'Source': 'Metacritic', 'Value': '61/100'}]",61,7.4,"180,580",tt7146812,movie,N/A,"$61,555,145",N/A,N/A,True,
Luca,2021,PG,18 Jun 2021,95 min,"Animation, Adventure, Comedy",Enrico Casarosa,"Enrico Casarosa, Jesse Andrews, Simon Stephenson","Jacob Tremblay, Jack Dylan Grazer, Emma Berman","On the Italian Riviera, an unlikely but strong friendship grows between a human being and a sea monster disguised as a human.","English, Italian",United States,Nominated for 1 Oscar. 6 wins & 83 nominations total,https://m.media-amazon.com/images/M/MV5BMWMyNGNlZTktODVkNS00ZmMyLTk0NmUtNWVjOWU1MWMzZGMzXkEyXkFqcGc@._V1_SX300.jpg,"[{'Source': 'Internet Movie Database', 'Value': '7.4/10'}, {'Source': 'Rotten Tomatoes', 'Value': '91%'}, {'Source': 'Metacritic', 'Value': '71/100'}]",71,7.4,"211,242",tt12801262,movie,N/A,"$1,324,302",N/A,N/A,True,
Shrek the Third,2007,PG,18 May 2007,93 min,"Animation, Adventure, Comedy","Chris Miller, Raman Hui","William Steig, Andrew Adamson, Jeffrey Price","Mike Myers, Cameron Diaz, Eddie Murphy","Reluctantly designated as the heir to the land of Far, Far Away, Shrek hatches a plan to install the rebellious Artie as the new king while Princess Fiona tries to fend off a coup d'état by the jilted Prince Charming.",English,United States,Nominated for 1 BAFTA Award5 wins & 17 nominations total,https://m.media-amazon.com/images/M/MV5BOTgyMjc3ODk2MV5BMl5BanBnXkFtZTcwMjY0MjEzMw@@._V1_SX300.jpg,"[{'Source': 'Internet Movie Database', 'Value': '6.1/10'}, {'Source': 'Rotten Tomatoes', 'Value': '41%'}, {'Source': 'Metacritic', 'Value': '58/100'}]",58,6.1,"348,816",tt0413267,movie,N/A,"$322,719,944",N/A,N/A,True,
Shrek Forever After,2010,PG,21 May 2010,93 min,"Animation, Adventure, Comedy",Mike Mitchell,"Josh Klausner, Darren Lemke, William Steig","Mike Myers, Cameron Diaz, Eddie Murphy",Rumpelstiltskin tricks a mid-life crisis burdened Shrek into allowing himself to be erased from existence and cast in a dark alternate timeline where Rumpelstiltskin rules supreme.,English,"United States, France",1 win & 13 nominations total,https://m.media-amazon.com/images/M/MV5BMTY0OTU1NzkxMl5BMl5BanBnXkFtZTcwMzI2NDUzMw@@._V1_SX300.jpg,"[{'Source': 'Internet Movie Database', 'Value': '6.3/10'}, {'Source': 'Rotten Tomatoes', 'Value': '58%'}, {'Source': 'Metacritic', 'Value': '58/100'}]",58,6.3,"236,105",tt0892791,movie,N/A,"$238,736,787",N/A,N/A,True,
Back to the Future,1985,PG,03 Jul 1985,116 min,"Adventure, Comedy, Sci-Fi",Robert Zemeckis,"Robert Zemeckis, Bob Gale","Michael J. Fox, Christopher Lloyd, Lea Thompson","Marty McFly, a 17-year-old high school student, is accidentally sent 30 years into the past in a time-traveling DeLorean invented by his close friend, the maverick scientist Doc Brown.",English,United States,Won 1 Oscar. 27 wins & 25 nominations total,https://m.media-amazon.com/images/M/MV5BZmM3ZjE0NzctNjBiOC00MDZmLTgzMTUtNGVlOWFlOTNiZDJiXkEyXkFqcGc@._V1_SX300.jpg,"[{'Source': 'Internet Movie Database', 'Value': '8.5/10'}, {'Source': 'Rotten Tomatoes', 'Value': '93%'}, {'Source': 'Metacritic', 'Value': '87/100'}]",87,8.5,"1,389,648",tt0088763,movie,N/A,"$214,553,307",N/A,N/A,True,
Jurassic Park,1993,PG-13,11 Jun 1993,127 min,"Action, Adventure, Sci-Fi",Steven Spielberg,"Michael Crichton, David Koepp","Sam Neill, Laura Dern, Jeff Goldblum","An industrialist invites some experts to visit his theme park of cloned dinosaurs. After a power failure, the creatures run loose, putting everyone's lives, including his grandchildren's, in danger.","English, Spanish",United States,Won 3 Oscars. 44 wins & 27 nominations total,https://m.media-amazon.com/images/M/MV5BMjM2MDgxMDg0Nl5BMl5BanBnXkFtZTgwNTM2OTM5NDE@._V1_SX300.jpg,"[{'Source': 'Internet Movie Database', 'Value': '8.2/10'}, {'Source': 'Rotten Tomatoes', 'Value': '91%'}, {'Source': 'Metacritic', 'Value': '68/100'}]",68,8.2,"1,130,773",tt0107290,movie,N/A,"$407,185,075",N/A,N/A,True,
Jurassic World,2015,PG-13,12 Jun 2015,124 min,"Action, Adventure, Sci-Fi",Colin Trevorrow,"Rick Jaffa, Amanda Silver, Colin Trevorrow","Chris Pratt, Bryce Dallas Howard, Ty Simpkins","A new theme park, built on the original site of Jurassic Park, creates a genetically modified hybrid dinosaur, the Indominus Rex, which escapes containment and goes on a killing spree.",English,"Japan, United States",15 wins & 58 nominations total,https://m.media-amazon.com/images/M/MV5BNzBhNzlkM2UtZTQyOC00NjUyLTkzMmMtNDQ1YTM5N2NmMGE5XkEyXkFqcGc@._V1_SX300.jpg,"[{'Source': 'Internet Movie Database', 'Value': '6.9/10'}, {'Source': 'Rotten Tomatoes', 'Value': '72%'}, {'Source': 'Metacritic', 'Value': '59/100'}]",59,6.9,"703,959",tt0369610,movie,N/A,"$653,406,625",N/A,N/A,True,
E.T. the Extra-Terrestrial,1982,PG,11 Jun 1982,115 min,"Adventure, Family, Sci-Fi",Steven Spielberg,Melissa Mathison,"Henry Thomas, Drew Barrymore, Peter Coyote",A troubled child summons the courage to help a friendly alien escape from Earth and return to his home planet.,English,United States,Won 4 Oscars. 52 wins & 38 nominations total,https://m.media-amazon.com/images/M/MV5BYTNhNmY0YWMtMTczYi00MTA0LThhMmUtMTIxYzE0Y2QwMzRlXkEyXkFqcGc@._V1_SX300.jpg,"[{'Source': 'Internet Movie Database', 'Value': '7.9/10'}, {'Source': 'Rotten Tomatoes', 'Value': '99%'}, {'Source': 'Metacritic', 'Value': '92/100'}]",92,7.9,"456,763",tt0083866,movie,N/A,"$439,454,989",N/A,N/A,True,
Forrest Gump,1994,PG-13,06 Jul 1994,142 min,"Drama, Romance",Robert Zemeckis,"Winston Groom, Eric Roth","Tom Hanks, Robin Wright, Gary Sinise","The history of the United States from the 1950s to the '70s unfolds from the perspective of an Alabama man with an IQ of 75, who yearns to be reunited with his childhood sweetheart.",English,United States,Won 6 Oscars. 51 wins & 74 nominations total,https://m.media-amazon.com/images/M/MV5BNDYwNzVjMTItZmU5YS00YjQ5LTljYjgtMjY2NDVmYWMyNWFmXkEyXkFqcGc@._V1_SX300.jpg,"[{'Source': 'Internet Movie Database', 'Value': '8.8/10'}, {'Source': 'Rotten Tomatoes', 'Value': '75%'}, {'Source': 'Metacritic', 'Value': '82/100'}]",82,8.8,"2,400,011",tt0109830,movie,N/A,"$330,455,270",N/A,N/A,True,
The Lion King,1994,G,24 Jun 1994,88 min,"Animation, Adventure, Drama","Roger Allers, Rob Minkoff","Irene Mecchi, Jonathan Roberts, Linda Woolverton","Matthew Broderick, Jeremy Irons, James Earl Jones","Lion prince Simba and his father are targeted by his bitter uncle, who wants to ascend the throne himself.","English, Swahili, Xhosa, Zulu",United States,Won 2 Oscars. 43 wins & 35 nominations total,https://m.media-amazon.com/images/M/MV5BZGRiZDZhZjItM2M3ZC00Y2IyLTk3Y2MtMWY5YjliNDFkZTJlXkEyXkFqcGc@._V1_SX300.jpg,"[{'Source': 'Internet Movie Database', 'Value': '8.5/10'}, {'Source': 'Rotten Tomatoes', 'Value': '93%'}, {'Source': 'Metacritic', 'Value': '88/100'}]",88,8.5,"1,204,496",tt0110357,movie,N/A,"$424,979,720",N/A,N/A,True,
Aladdin,1992,G,25 Nov 1992,90 min,"Animation, Adventure, Comedy","Ron Clements, John Musker","Ron Clements, John Musker, Ted Elliott","Scott Weinger, Robin Williams, Linda Larkin",A kind-hearted street urchin and a power-hungry Grand Vizier vie for a magic lamp that has the power to make their deepest wishes come true.,English,United States,Won 2 Oscars. 35 wins & 22 nominations total,https://m.media-amazon.com/images/M/MV5BMmQwYWZjZGItYzc0OC00ZDllLTg3NjItOWIyOWYwMDljMjAyXkEyXkFqcGc@._V1_SX300.jpg,"[{'Source': 'Internet Movie Database', 'Value': '8.0/10'}, {'Source': 'Rotten Tomatoes', 'Value': '96%'}, {'Source': 'Metacritic', 'Value': '86/100'}]",86,8.0,"488,970",tt0103639,movie,N/A,"$217,350,219",N/A,N/A,True,
Mulan,1998,G,19 Jun 1998,87 min,"Animation, Adventure, Comedy","Tony Bancroft, Barry Cook","Robert D. San Souci, Rita Hsiao, Chris Sanders","Ming-Na Wen, Eddie Murphy, BD Wong","To save her father from death in the army, a young maiden secretly goes in his place and becomes one of China's greatest heroines in the process.","English, Mandarin",United States,Nominated for 1 Oscar. 17 wins & 21 nominations total,https://m.media-amazon.com/images/M/MV5BYzU0ZTQxZDktOGY0Yy00NjdiLTllNDItMTMzMjI1YjMyYjRhXkEyXkFqcGc@._V1_SX300.jpg,"[{'Source': 'Internet Movie Database', 'Value': '7.7/10'}, {'Source': 'Rotten Tomatoes', 'Value': '92%'}, {'Source': 'Metacritic', 'Value': '72/100'}]",72,7.7,"332,899",tt0120762,movie,N/A,"$120,620,254",N/A,N/A,True,
The Matrix,1999,R,31 Mar 1999,136 min,"Action, Sci-Fi","Lana Wachowski, Lilly Wachowski","Lilly Wachowski, Lana Wachowski","Keanu Reeves, Laurence Fishburne, Carrie-Anne Moss","When a beautiful stranger leads computer hacker Neo to a forbidding underworld, he discovers the shocking truth--the life he knows is the elaborate deception of an evil cyber-intelligence.",English,"United States, Australia",Won 4 Oscars. 42 wins & 52 nominations total,https://m.media-amazon.com/images/M/MV5BN2NmN2VhMTQtMDNiOS00NDlhLTliMjgtODE2ZTY0ODQyNDRhXkEyXkFqcGc@._V1_SX300.jpg,"[{'Source': 'Internet Movie Database', 'Value': '8.7/10'}, {'Source': 'Rotten Tomatoes', 'Value': '83%'}, {'Source': 'Metacritic', 'Value': '73/100'}]",73,8.7,"2,170,119",tt0133093,movie,N/A,"$172,076,928",N/A,N/A,True,
Inception,2010,PG-13,16 Jul 2010,148 min,"Action, Adventure, Sci-Fi",Christopher Nolan,Christopher Nolan,"Leonardo DiCaprio, Joseph Gordon-Levitt, Elliot Page","A thief who steals corporate secrets through the use of dream-sharing technology is given the inverse task of planting an idea into the mind of a C.E.O., but his tragic past may doom the project and his team to disaster.","English, Japanese, French","United States, United Kingdom",Won 4 Oscars. 159 wins & 220 nominations total,https://m.media-amazon.com/images/M/MV5BMjAxMzY3NjcxNF5BMl5BanBnXkFtZTcwNTI5OTM0Mw@@._V1_SX300.jpg,"[{'Source': 'Internet Movie Database', 'Value': '8.8/10'}, {'Source': 'Rotten Tomatoes', 'Value': '87%'}, {'Source': 'Metacritic', 'Value': '74/100'}]",74,8.8,"2,705,756",tt1375666,movie,N/A,"$292,587,330",N/A,N/A,True,
Pirates of the Caribbean: The Curse of the Black Pearl,2003,PG-13,09 Jul 2003,143 min,"Action, Adventure, Fantasy",Gore Verbinski,"Ted Elliott, Terry Rossio, Stuart Beattie","Johnny Depp, Geoffrey Rush, Orlando Bloom","Blacksmith Will Turner teams up with eccentric pirate ""Captain"" Jack Sparrow to save Elizabeth Swann, the governor's daughter and his love, from Jack's former pirate allies, who are now undead.",English,United States,Nominated for 5 Oscars. 38 wins & 104 nominations total,https://m.media-amazon.com/images/M/MV5BNDhlMzEyNzItMTA5Mi00YWRhLThlNTktYTQyMTA0MDIyNDEyXkEyXkFqcGc@._V1_SX300.jpg,"[{'Source': 'Internet Movie Database', 'Value': '8.1/10'}, {'Source': 'Rotten Tomatoes', 'Value': '79%'}, {'Source': 'Metacritic', 'Value': '63/100'}]",63,8.1,"1,276,659",tt0325980,movie,N/A,"$305,413,918",N/A,N/A,True,
Rocky,1976,PG,03 Dec 1976,120 min,"Drama, Sport",John G. Avildsen,Sylvester Stallone,"Sylvester Stallone, Talia Shire, Burt Young",A small-time Philadelphia boxer gets a supremely rare chance to fight the world heavyweight champion in a bout in which he strives to go the distance for his self-respect.,"English, Spanish, Italian",United States,Won 3 Oscars. 22 wins & 23 nominations total,https://m.media-amazon.com/images/M/MV5BZDEyY2M2MGMtYjg5OC00ZWFjLWFkZDQtNmQzZTdiYmYzZTBkXkEyXkFqcGc@._V1_SX300.jpg,"[{'Source': 'Internet Movie Database', 'Value': '8.1/10'}, {'Source': 'Rotten Tomatoes', 'Value': '93%'}, {'Source': 'Metacritic', 'Value': '70/100'}]",70,8.1,"662,404",tt0075148,movie,N/A,"$117,235,147",N/A,N/A,True,
Rocky II,1979,PG,15 Jun 1979,119 min,"Drama, Sport",Sylvester Stallone,Sylvester Stallone,"Sylvester Stallone, Talia Shire, Burt Young","Rocky struggles in family life after his bout with Apollo Creed, while the embarrassed champ insistently goads him to accept a challenge for a rematch.","English, Italian",United States,2 wins & 2 nominations total,https://m.media-amazon.com/images/M/MV5BMDUxMWExZDctZTk4Zi00ZDFiLTgwYWUtNjEyYzA0NWQyYTJlXkEyXkFqcGc@._V1_SX300.jpg,"[{'Source': 'Internet Movie Database', 'Value': '7.3/10'}, {'Source': 'Rotten Tomatoes', 'Value': '70%'}, {'Source': 'Metacritic', 'Value': '61/100'}]",61,7.3,"239,581",tt0079817,movie,N/A,"$85,182,160",N/A,N/A,True,
Rocky III,1982,PG,28 May 1982,99 min,"Drama, Sport",Sylvester Stallone,Sylvester Stallone,"Sylvester Stallone, Talia Shire, Burt Young","Rocky faces the ultimate challenge from a powerful new contender, and must turn to a former rival to help regain his throne as the undisputed fighting champion.",English,United States,Nominated for 1 Oscar. 3 wins & 9 nominations total,https://m.media-amazon.com/images/M/MV5BNDYzNDQ3Y2MtODc1Zi00ZTBkLWIzZWUtOGY0NGZmYWZhMWQ5XkEyXkFqcGc@._V1_SX300.jpg,"[{'Source': 'Internet Movie Database', 'Value': '6.8/10'}, {'Source': 'Rotten Tomatoes', 'Value': '65%'}, {'Source': 'Metacritic', 'Value': '57/100'}]",57,6.8,"219,513",tt0084602,movie,N/A,"$125,049,125",N/A,N/A,True,
Rocky IV,1985,PG,27 Nov 1985,91 min,"Drama, Sport",Sylvester Stallone,Sylvester Stallone,"Sylvester Stallone, Talia Shire, Burt Young","Rocky Balboa proudly holds the world heavyweight boxing championship, but a new challenger has stepped forward: Drago, a six-foot-six, 261-pound fighter who has the backing of the Soviet Union.","English, Russian",United States,9 wins & 8 nominations total,https://m.media-amazon.com/images/M/MV5BNjJiYzRiYWMtZTgyZC00YjliLWIwZWMtZTJlYjkyYzc2MDMxXkEyXkFqcGc@._V1_SX300.jpg,"[{'Source': 'Internet Movie Database', 'Value': '6.9/10'}, {'Source': 'Rotten Tomatoes', 'Value': '39%'}, {'Source': 'Metacritic', 'Value': '40/100'}]",40,6.9,"234,117",tt0089927,movie,N/A,"$127,873,716",N/A,N/A,True,
Creed,2015,PG-13,25 Nov 2015,133 min,"Action, Drama, Sport",Ryan Coogler,"Ryan Coogler, Aaron Covington, Sylvester Stallone","Michael B. Jordan, Sylvester Stallone, Tessa Thompson","The former World Heavyweight Champion Rocky Balboa serves as a trainer and mentor to Adonis Johnson, the son of his late friend and former rival Apollo Creed.","English, Spanish",United States,Nominated for 1 Oscar. 45 wins & 66 nominations total,https://m.media-amazon.com/images/M/MV5BNWM3NjY2ZDctMGZiYy00OGFlLThkMTktOTY2MDM2YjE2OTliXkEyXkFqcGc@._V1_SX300.jpg,"[{'Source': 'Internet Movie Database', 'Value': '7.6/10'}, {'Source': 'Rotten Tomatoes', 'Value': '95%'}, {'Source': 'Metacritic', 'Value': '82/100'}]",82,7.6,"323,029",tt3076658,movie,N/A,"$109,778,883",N/A,N/A,True,
Spider-Man (2002),2002,N/A,23 Sep 2021,N/A,N/A,N/A,N/A,N/A,N/A,N/A,N/A,N/A,N/A,[],N/A,N/A,N/A,tt17979362,movie,N/A,N/A,N/A,N/A,True,
Spider-Man 2,2004,PG-13,30 Jun 2004,127 min,"Action, Adventure, Sci-Fi",Sam Raimi,"Stan Lee, Steve Ditko, Alfred Gough","Tobey Maguire, Kirsten Dunst, Alfred Molina",Peter Parker is beset with troubles in his failing personal life as he battles a former brilliant scientist named Otto Octavius.,"English, Russian, Chinese",United States,Won 1 Oscar. 25 wins & 60 nominations total,https://m.media-amazon.com/images/M/MV5BNGQ0YTQyYTgtNWI2YS00NTE2LWJmNDItNTFlMTUwNmFlZTM0XkEyXkFqcGc@._V1_SX300.jpg,"[{'Source': 'Internet Movie Database', 'Value': '7.5/10'}, {'Source': 'Rotten Tomatoes', 'Value': '93%'}, {'Source': 'Metacritic', 'Value': '83/100'}]",83,7.5,"753,581",tt0316654,movie,N/A,"$374,337,514",N/A,N/A,True,
Spider-Man 3,2007,PG-13,04 May 2007,139 min,"Action, Adventure, Sci-Fi",Sam Raimi,"Sam Raimi, Ivan Raimi, Alvin Sargent","Tobey Maguire, Kirsten Dunst, Topher Grace","A strange black entity from another world bonds with Peter Parker and causes inner turmoil as he contends with new villains, temptations, and revenge.","English, French",United States,Nominated for 1 BAFTA Award4 wins & 44 nominations total,https://m.media-amazon.com/images/M/MV5BODE2NzNhMDctYjUzMC00Y2M5LWI2Y2EtODJkZTFjN2Y5ODlmXkEyXkFqcGc@._V1_SX300.jpg,"[{'Source': 'Internet Movie Database', 'Value': '6.3/10'}, {'Source': 'Rotten Tomatoes', 'Value': '63%'}, {'Source': 'Metacritic', 'Value': '59/100'}]",59,6.3,"670,907",tt0413300,movie,N/A,"$337,281,992",N/A,N/A,True,
The Dark Knight,2008,PG-13,18 Jul 2008,152 min,"Action, Crime, Drama",Christopher Nolan,"Jonathan Nolan, Christopher Nolan, David S. Goyer","Christian Bale, Heath Ledger, Aaron Eckhart","When a menace known as the Joker wreaks havoc and chaos on the people of Gotham, Batman, James Gordon and Harvey Dent must work together to put an end to the madness.","English, Mandarin","United States, United Kingdom",Won 2 Oscars. 163 wins & 165 nominations total,https://m.media-amazon.com/images/M/MV5BMTMxNTMwODM0NF5BMl5BanBnXkFtZTcwODAyMTk2Mw@@._V1_SX300.jpg,"[{'Source': 'Internet Movie Database', 'Value': '9.0/10'}, {'Source': 'Rotten Tomatoes', 'Value': '94%'}, {'Source': 'Metacritic', 'Value': '85/100'}]",85,9.0,"3,044,547",tt0468569,movie,N/A,"$534,987,076",N/A,N/A,True,
Batman Begins,2005,PG-13,15 Jun 2005,140 min,"Action, Crime, Drama",Christopher Nolan,"Bob Kane, David S. Goyer, Christopher Nolan","Christian Bale, Michael Caine, Ken Watanabe","After witnessing his parents' death, billionaire Bruce Wayne learns the art of fighting to confront injustice. When he returns to Gotham as Batman, he must stop a secret society that intends to destroy the city.","English, Mandarin","United States, United Kingdom",Nominated for 1 Oscar. 15 wins & 79 nominations total,https://m.media-amazon.com/images/M/MV5BODIyMDdhNTgtNDlmOC00MjUxLWE2NDItODA5MTdkNzY3ZTdhXkEyXkFqcGc@._V1_SX300.jpg,"[{'Source': 'Internet Movie Database', 'Value': '8.2/10'}, {'Source': 'Rotten Tomatoes', 'Value': '85%'}, {'Source': 'Metacritic', 'Value': '70/100'}]",70,8.2,"1,652,636",tt0372784,movie,N/A,"$206,863,479",N/A,N/A,True,
The Dark Knight Rises,2012,PG-13,20 Jul 2012,164 min,"Action, Crime, Drama",Christopher Nolan,"Jonathan Nolan, Christopher Nolan, David S. Goyer","Christian Bale, Tom Hardy, Anne Hathaway","Bane, an imposing terrorist, attacks Gotham City and disrupts its eight-year-long period of peace. This forces Bruce Wayne to come out of hiding and don the cape and cowl of Batman again.","English, Arabic","United States, United Kingdom",Nominated for 1 BAFTA Award45 wins & 103 nominations total,https://m.media-amazon.com/images/M/MV5BMTk4ODQzNDY3Ml5BMl5BanBnXkFtZTcwODA0NTM4Nw@@._V1_SX300.jpg,"[{'Source': 'Internet Movie Database', 'Value': '8.4/10'}, {'Source': 'Rotten Tomatoes', 'Value': '87%'}, {'Source': 'Metacritic', 'Value': '78/100'}]",78,8.4,"1,926,092",tt1345836,movie,N/A,"$448,149,584",N/A,N/A,True,
Joker,2019,R,04 Oct 2019,122 min,"Crime, Drama, Thriller",Todd Phillips,"Todd Phillips, Scott Silver, Bob Kane","Joaquin Phoenix, Robert De Niro, Zazie Beetz","Arthur Fleck, a party clown and a failed stand-up comedian, leads an impoverished life with his ailing mother. However, when society shuns him and brands him as a freak, he decides to embrace the life of chaos in Gotham City.","English, German","United States, Canada, Australia",Won 2 Oscars. 121 wins & 248 nominations total,https://m.media-amazon.com/images/M/MV5BNzY3OWQ5NDktNWQ2OC00ZjdlLThkMmItMDhhNDk3NTFiZGU4XkEyXkFqcGc@._V1_SX300.jpg,"[{'Source': 'Internet Movie Database', 'Value': '8.3/10'}, {'Source': 'Rotten Tomatoes', 'Value': '68%'}, {'Source': 'Metacritic', 'Value': '59/100'}]",59,8.3,"1,619,842",tt7286456,movie,N/A,"$335,477,657",N/A,N/A,True,
Frozen,2013,PG,27 Nov 2013,102 min,"Animation, Adventure, Comedy","Chris Buck, Jennifer Lee","Jennifer Lee, Hans Christian Andersen, Chris Buck","Kristen Bell, Idina Menzel, Jonathan Groff","Fearless optimist Anna teams up with rugged mountain man Kristoff and his loyal reindeer Sven in an epic journey to find Anna's sister Elsa, whose icy powers have trapped the kingdom of Arendelle in eternal winter.",English,United States,Won 2 Oscars. 83 wins & 60 nominations total,https://m.media-amazon.com/images/M/MV5BMTQ1MjQwMTE5OF5BMl5BanBnXkFtZTgwNjk3MTcyMDE@._V1_SX300.jpg,"[{'Source': 'Internet Movie Database', 'Value': '7.4/10'}, {'Source': 'Rotten Tomatoes', 'Value': '89%'}, {'Source': 'Metacritic', 'Value': '75/100'}]",75,7.4,"692,942",tt2294629,movie,N/A,"$400,953,009",N/A,N/A,True,
Titanic,1997,PG-13,19 Dec 1997,194 min,"Drama, Romance",James Cameron,James Cameron,"Leonardo DiCaprio, Kate Winslet, Billy Zane","A seventeen-year-old aristocrat falls in love with a kind but poor artist aboard the luxurious, ill-fated R.M.S. Titanic.","English, Swedish, Italian, French",United States,Won 11 Oscars. 126 wins & 83 nominations total,https://m.media-amazon.com/images/M/MV5BYzYyN2FiZmUtYWYzMy00MzViLWJkZTMtOGY1ZjgzNWMwN2YxXkEyXkFqcGc@._V1_SX300.jpg,"[{'Source': 'Internet Movie Database', 'Value': '7.9/10'}, {'Source': 'Rotten Tomatoes', 'Value': '88%'}, {'Source': 'Metacritic', 'Value': '75/100'}]",75,7.9,"1,343,916",tt0120338,movie,N/A,"$674,354,882",N/A,N/A,True,
The Shawshank Redemption,1994,R,14 Oct 1994,142 min,Drama,Frank Darabont,"Stephen King, Frank Darabont","Tim Robbins, Morgan Freeman, Bob Gunton","A banker convicted of uxoricide forms a friendship over a quarter century with a hardened convict, while maintaining his innocence and trying to remain hopeful through simple compassion.",English,United States,Nominated for 7 Oscars. 21 wins & 42 nominations total,https://m.media-amazon.com/images/M/MV5BMDAyY2FhYjctNDc5OS00MDNlLThiMGUtY2UxYWVkNGY2ZjljXkEyXkFqcGc@._V1_SX300.jpg,"[{'Source': 'Internet Movie Database', 'Value': '9.3/10'}, {'Source': 'Rotten Tomatoes', 'Value': '89%'}, {'Source': 'Metacritic', 'Value': '82/100'}]",82,9.3,"3,059,994",tt0111161,movie,N/A,"$28,767,189",N/A,N/A,True,
Pulp Fiction,1994,R,14 Oct 1994,154 min,"Crime, Drama",Quentin Tarantino,"Quentin Tarantino, Roger Avary","John Travolta, Uma Thurman, Samuel L. Jackson","The lives of two mob hitmen, a boxer, a gangster and his wife, and a pair of diner bandits intertwine in four tales of violence and redemption.","English, Spanish, French",United States,Won 1 Oscar. 69 wins & 72 nominations total,https://m.media-amazon.com/images/M/MV5BYTViYTE3ZGQtNDBlMC00ZTAyLTkyODMtZGRiZDg0MjA2YThkXkEyXkFqcGc@._V1_SX300.jpg,"[{'Source': 'Internet Movie Database', 'Value': '8.8/10'}, {'Source': 'Rotten Tomatoes', 'Value': '92%'}, {'Source': 'Metacritic', 'Value': '95/100'}]",95,8.8,"2,352,993",tt0110912,movie,N/A,"$107,928,762",N/A,N/A,True,
The Godfather,1972,R,24 Mar 1972,175 min,"Crime, Drama",Francis Ford Coppola,"Mario Puzo, Francis Ford Coppola","Marlon Brando, Al Pacino, James Caan",The aging patriarch of an organized crime dynasty transfers control of his clandestine empire to his reluctant son.,"English, Italian, Latin",United States,Won 3 Oscars. 31 wins & 31 nominations total,https://m.media-amazon.com/images/M/MV5BNGEwYjgwOGQtYjg5ZS00Njc1LTk2ZGEtM2QwZWQ2NjdhZTE5XkEyXkFqcGc@._V1_SX300.jpg,"[{'Source': 'Internet Movie Database', 'Value': '9.2/10'}, {'Source': 'Rotten Tomatoes', 'Value': '97%'}, {'Source': 'Metacritic', 'Value': '100/100'}]",100,9.2,"2,142,249",tt0068646,movie,N/A,"$136,381,073",N/A,N/A,True,
RiffTrax: Star Wars: The Force Awakens,2016,N/A,25 Apr 2016,N/A,Comedy,N/A,"Conor Lastowka, Michael J. Nelson, Sean Thomason","Bill Corbett, Kevin Murphy, Michael J. Nelson","Scavenger girl Rey leaves her junkyard home to fulfill her destiny of escorting a robot around the galaxy. Mike Nelson, Bill Corbett, and Kevin Murphy are here to see if there's more to the story in this humorous commentary.",English,United States,N/A,https://m.media-amazon.com/images/M/MV5BYjk3YTdlOGItOThmZS00ZGZjLTg3NTUtZTI0OGViYTMyOTJjXkEyXkFqcGc@._V1_SX300.jpg,"[{'Source': 'Internet Movie Database', 'Value': '2.8/10'}]",N/A,2.8,33,tt10321138,movie,N/A,N/A,N/A,N/A,True,
Star Wars: The Last Jedi,2008,N/A,16 Sep 2008,3 min,"Short, Action, Fantasy",N/A,N/A,Taylor Clark,Two kids fight with light sabers around the house.,English,United States,N/A,https://m.media-amazon.com/images/M/MV5BOWFmNmMwZmYtZjA2Mi00ZWEwLTkyZTktMjQ0MWI0MWRhM2ExXkEyXkFqcGc@._V1_SX300.jpg,"[{'Source': 'Internet Movie Database', 'Value': '7.1/10'}]",N/A,7.1,157,tt3486354,movie,N/A,N/A,N/A,N/A,True,
RiffTrax: Star Wars: The Rise of Skywalker,2020,TV-14,03 Apr 2020,N/A,"Comedy, Sci-Fi",N/A,"Bill Corbett, Conor Lastowka, Jason Miller","Bill Corbett, Kevin Murphy, Michael J. Nelson","Ever since the original premiered in 1977, Star Wars fans have waited to see how the Skywalker saga would end.",English,United States,N/A,https://m.media-amazon.com/images/M/MV5BZGFiZWNkNTItNmJkMy00NzRmLWE0ZTItMzk2ZDVmODI0ZmFmXkEyXkFqcGc@._V1_SX300.jpg,[],N/A,N/A,21,tt15662564,movie,N/A,N/A,N/A,N/A,True,
The Hobbit: An Unexpected Journey,2012,PG-13,14 Dec 2012,169 min,"Adventure, Fantasy",Peter Jackson,"Fran Walsh, Philippa Boyens, Peter Jackson","Martin Freeman, Ian McKellen, Richard Armitage","A reluctant Hobbit, Bilbo Baggins, sets out to the Lonely Mountain with a spirited group of dwarves to reclaim their mountain home and the gold within it from the dragon Smaug.",English,"New Zealand, United States",Nominated for 3 Oscars. 11 wins & 76 nominations total,https://m.media-amazon.com/images/M/MV5BMTcwNTE4MTUxMl5BMl5BanBnXkFtZTcwMDIyODM4OA@@._V1_SX300.jpg,"[{'Source': 'Internet Movie Database', 'Value': '7.8/10'}, {'Source': 'Rotten Tomatoes', 'Value': '64%'}, {'Source': 'Metacritic', 'Value': '58/100'}]",58,7.8,"904,929",tt0903624,movie,N/A,"$303,030,651",N/A,N/A,True,
