
The Hobbit: The Desolation of Smaug,2013,PG-13,13 Dec 2013,161 min,"Adventure, Fantasy",Peter Jackson,"Fran Walsh, Philippa Boyens, Peter Jackson","Ian McKellen, Martin Freeman, Richard Armitage","The dwarves, along with Bilbo Baggins and Gandalf the Grey, continue their quest to reclaim the Lonely Mountain, their homeland, from the dragon Smaug.",English,"New Zealand, United States",Nominated for 3 Oscars. 19 wins & 90 nominations total,https://m.media-amazon.com/images/M/MV5BMzU0NDY0NDEzNV5BMl5BanBnXkFtZTgwOTIxNDU1MDE@._V1_SX300.jpg,"[{'Source': 'Internet Movie Database', 'Value': '7.8/10'}, {'Source': 'Rotten Tomatoes', 'Value': '74%'}, {'Source': 'Metacritic', 'Value': '66/100'}]",66,7.8,"733,348",tt1170358,movie,N/A,"$258,387,334",N/A,N/A,True,
The Hobbit: The Battle of the Five Armies,2014,R,17 Dec 2014,144 min,"Adventure, Fantasy",Peter Jackson,"Fran Walsh, Philippa Boyens, Peter Jackson","Ian McKellen, Martin Freeman, Richard Armitage",Bilbo Baggins and company are forced to engage in a war against an array of combatants and keep the Lonely Mountain from falling into the hands of a rising darkness.,English,"New Zealand, United States",Nominated for 1 Oscar. 8 wins & 56 nominations total,https://m.media-amazon.com/images/M/MV5BMTYzNDE3OTQ3MF5BMl5BanBnXkFtZTgwODczMTg4MjE@._V1_SX300.jpg,"[{'Source': 'Internet Movie Database', 'Value': '7.4/10'}, {'Source': 'Rotten Tomatoes', 'Value': '59%'}, {'Source': 'Metacritic', 'Value': '59/100'}]",59,7.4,"600,266",tt2310332,movie,N/A,"$255,138,261",N/A,N/A,True,
Despicable Me,2010,PG,09 Jul 2010,95 min,"Animation, Adventure, Comedy","Pierre Coffin, Chris Renaud","Cinco Paul, Ken Daurio, Sergio Pablos","Steve Carell, Jason Segel, Russell Brand","Gru, a criminal mastermind, adopts three orphans as pawns to carry out the biggest heist in history. His life takes an unexpected turn when the little girls see the evildoer as their potential father.",English,"United States, France",Nominated for 1 BAFTA Award3 wins & 41 nominations total,https://m.media-amazon.com/images/M/MV5BMTY3NjY0MTQ0Nl5BMl5BanBnXkFtZTcwMzQ2MTc0Mw@@._V1_SX300.jpg,"[{'Source': 'Internet Movie Database', 'Value': '7.6/10'}, {'Source': 'Rotten Tomatoes', 'Value': '80%'}, {'Source': 'Metacritic', 'Value': '72/100'}]",72,7.6,"613,852",tt1323594,movie,N/A,"$251,683,815",N/A,N/A,True,
Despicable Me 2,2013,PG,03 Jul 2013,98 min,"Animation, Adventure, Comedy","Pierre Coffin, Chris Renaud","Cinco Paul, Ken Daurio","Steve Carell, Kristen Wiig, Benjamin Bratt","When a new criminal comes to town, the Anti-Villain League decides to hire Gru in order to fight him off. While Gru initially refuses, he eventually agrees after his aide goes back to his evil ways.","English, Ukrainian","United States, France",Nominated for 2 Oscars. 12 wins & 66 nominations total,https://m.media-amazon.com/images/M/MV5BNDExNDllYzMtZjdmOS00NWMwLWJlY2EtMDk2ZjE5MmZiOWY5XkEyXkFqcGc@._V1_SX300.jpg,"[{'Source': 'Internet Movie Database', 'Value': '7.3/10'}, {'Source': 'Rotten Tomatoes', 'Value': '75%'}, {'Source': 'Metacritic', 'Value': '62/100'}]",62,7.3,"446,777",tt1690953,movie,N/A,"$368,065,385",N/A,N/A,True,
Despicable Me 3,2017,PG,30 Jun 2017,89 min,"Animation, Adventure, Comedy","Kyle Balda, Pierre Coffin, Eric Guillon","Cinco Paul, Ken Daurio","Steve Carell, Kristen Wiig, Trey Parker","Gru meets his long-lost, charming, cheerful, and more successful twin brother Dru, who wants to team up with him for one last criminal heist.",English,"United States, France",33 nominations total,https://m.media-amazon.com/images/M/MV5BNjUyNzQ2MTg3Ml5BMl5BanBnXkFtZTgwNzE4NDM3MTI@._V1_SX300.jpg,"[{'Source': 'Internet Movie Database', 'Value': '6.3/10'}, {'Source': 'Rotten Tomatoes', 'Value': '59%'}, {'Source': 'Metacritic', 'Value': '49/100'}]",49,6.3,"171,188",tt3469046,movie,N/A,"$264,624,300",N/A,N/A,True,
Minions,2015,PG,10 Jul 2015,91 min,"Animation, Adventure, Comedy","Kyle Balda, Pierre Coffin",Brian Lynch,"Sandra Bullock, Jon Hamm, Michael Keaton","Minions Stuart, Kevin, and Bob are recruited by Scarlet Overkill, a supervillain who, alongside her inventor husband Herb, hatches a plot to take over the world.","English, Spanish, Italian","United States, France",Nominated for 1 BAFTA Award4 wins & 29 nominations total,https://m.media-amazon.com/images/M/MV5BODI4NzMyNjE0MF5BMl5BanBnXkFtZTgwMTcwNzI0MzE@._V1_SX300.jpg,"[{'Source': 'Internet Movie Database', 'Value': '6.4/10'}, {'Source': 'Rotten Tomatoes', 'Value': '55%'}, {'Source': 'Metacritic', 'Value': '56/100'}]",56,6.4,"275,254",tt2293640,movie,N/A,"$336,045,770",N/A,N/A,True,
Jumanji: Welcome to the Jungle,2017,PG-13,20 Dec 2017,119 min,"Action, Adventure, Comedy",Jake Kasdan,"Chris McKenna, Erik Sommers, Scott Rosenberg","Dwayne Johnson, Karen Gillan, Kevin Hart","Four teenagers are sucked into a magical video game, and the only way they can escape is to work together to finish the game.",English,"United States, Australia, Canada, Mexico, India, United Kingdom",5 wins & 15 nominations total,https://m.media-amazon.com/images/M/MV5BZjI5MzdmODctYjA4NS00ZmMxLWJlOWUtOGVhMjA0OGMxMWYzXkEyXkFqcGc@._V1_SX300.jpg,"[{'Source': 'Internet Movie Database', 'Value': '7.0/10'}, {'Source': 'Rotten Tomatoes', 'Value': '77%'}, {'Source': 'Metacritic', 'Value': '58/100'}]",58,7.0,"480,218",tt2283362,movie,N/A,"$404,540,171",N/A,N/A,True,
Jumanji,1995,PG,15 Dec 1995,104 min,"Adventure, Comedy, Family",Joe Johnston,"Jonathan Hensleigh, Greg Taylor, Jim Strain","Robin Williams, Kirsten Dunst, Bonnie Hunt",A magic board game summons jungle perils and a missing boy.,"English, French",United States,4 wins & 11 nominations total,https://m.media-amazon.com/images/M/MV5BYTFkMjFmODgtYzRiZi00NmQwLTliZWMtMzRhMWQ5ZmY3ZDExXkEyXkFqcGc@._V1_SX300.jpg,"[{'Source': 'Internet Movie Database', 'Value': '7.1/10'}, {'Source': 'Rotten Tomatoes', 'Value': '52%'}, {'Source': 'Metacritic', 'Value': '39/100'}]",39,7.1,"399,171",tt0113497,movie,N/A,"$100,499,940",N/A,N/A,True,
Spider-Man: Into the Spider-Verse,2018,PG,14 Dec 2018,117 min,"Animation, Action, Adventure","Bob Persichetti, Peter Ramsey, Rodney Rothman","Phil Lord, Rodney Rothman","Shameik Moore, Jake Johnson, Hailee Steinfeld",Teen Miles Morales becomes the Spider-Man of his universe and must join with five spider-powered individuals from other dimensions to stop a threat for all realities.,"English, Spanish","Canada, United States",Won 1 Oscar. 85 wins & 60 nominations total,https://m.media-amazon.com/images/M/MV5BMjMwNDkxMTgzOF5BMl5BanBnXkFtZTgwNTkwNTQ3NjM@._V1_SX300.jpg,"[{'Source': 'Internet Movie Database', 'Value': '8.4/10'}, {'Source': 'Rotten Tomatoes', 'Value': '97%'}, {'Source': 'Metacritic', 'Value': '87/100'}]",87,8.4,"741,247",tt4633694,movie,N/A,"$190,241,310",N/A,N/A,True,
The Amazing Spider-Man,2012,PG-13,03 Jul 2012,136 min,"Action, Sci-Fi",Marc Webb,"James Vanderbilt, Alvin Sargent, Steve Kloves","Andrew Garfield, Emma Stone, Rhys Ifans","After Peter Parker is bitten by a genetically altered spider, he gains newfound, spider-like powers and ventures out to save the city from the machinations of a mysterious reptilian foe.",English,United States,2 wins & 33 nominations total,https://m.media-amazon.com/images/M/MV5BMjMyOTM4MDMxNV5BMl5BanBnXkFtZTcwNjIyNzExOA@@._V1_SX300.jpg,"[{'Source': 'Internet Movie Database', 'Value': '6.9/10'}, {'Source': 'Rotten Tomatoes', 'Value': '71%'}, {'Source': 'Metacritic', 'Value': '66/100'}]",66,6.9,"733,512",tt0948470,movie,N/A,"$262,782,352",N/A,N/A,True,
The Amazing Spider-Man 2,2014,PG-13,02 May 2014,142 min,"Action, Adventure, Sci-Fi",Marc Webb,"Alex Kurtzman, Roberto Orci, Jeff Pinkner","Andrew Garfield, Emma Stone, Jamie Foxx","When New York is put under siege by Oscorp, it is up to Spider-Man to save the city he swore to protect as well as his loved ones.",English,United States,4 wins & 30 nominations total,https://m.media-amazon.com/images/M/MV5BOTA5NDYxNTg0OV5BMl5BanBnXkFtZTgwODE5NzU1MTE@._V1_SX300.jpg,"[{'Source': 'Internet Movie Database', 'Value': '6.6/10'}, {'Source': 'Rotten Tomatoes', 'Value': '50%'}, {'Source': 'Metacritic', 'Value': '53/100'}]",53,6.6,"565,670",tt1872181,movie,N/A,"$203,605,622",N/A,N/A,True,
Deadpool,2016,R,12 Feb 2016,108 min,"Action, Comedy, Sci-Fi",Tim Miller,"Rhett Reese, Paul Wernick","Ryan Reynolds, Morena Baccarin, T.J. Miller","A wisecracking mercenary gets experimented on and becomes immortal yet hideously scarred, and sets out to track down the man who ruined his looks.",English,United States,29 wins & 78 nominations total,https://m.media-amazon.com/images/M/MV5BNzY3ZWU5NGQtOTViNC00ZWVmLTliNjAtNzViNzlkZWQ4YzQ4XkEyXkFqcGc@._V1_SX300.jpg,"[{'Source': 'Internet Movie Database', 'Value': '8.0/10'}, {'Source': 'Rotten Tomatoes', 'Value': '85%'}, {'Source': 'Metacritic', 'Value': '65/100'}]",65,8.0,"1,214,570",tt1431045,movie,N/A,"$363,070,709",N/A,N/A,True,
Deadpool 2,2018,R,18 May 2018,119 min,"Action, Adventure, Comedy",David Leitch,"Rhett Reese, Paul Wernick, Ryan Reynolds","Ryan Reynolds, Josh Brolin, Morena Baccarin","Foul-mouthed mutant mercenary Wade Wilson (a.k.a. Deadpool) assembles a team of fellow mutant rogues to protect a young boy with abilities from the brutal, time-traveling cyborg Cable.","English, Cantonese, Spanish, Russian","United States, Canada",6 wins & 52 nominations total,https://m.media-amazon.com/images/M/MV5BNGY3N2ZhYmMtYTlmYi00ZWIzLWJiZWMtMjgxMjljYTk3MDAwXkEyXkFqcGc@._V1_SX300.jpg,"[{'Source': 'Internet Movie Database', 'Value': '7.6/10'}, {'Source': 'Rotten Tomatoes', 'Value': '84%'}, {'Source': 'Metacritic', 'Value': '66/100'}]",66,7.6,"716,383",tt5463162,movie,N/A,"$324,591,735",N/A,N/A,True,
Logan,2017,R,03 Mar 2017,137 min,"Action, Drama, Sci-Fi",James Mangold,"James Mangold, Scott Frank, Michael Green","Hugh Jackman, Patrick Stewart, Dafne Keen","In a future where mutants are nearly extinct, an elderly and weary Logan leads a quiet life. But when Laura, a mutant child pursued by scientists, comes to him for help, he must get her to safety.","English, Spanish",United States,Nominated for 1 Oscar. 28 wins & 82 nominations total,https://m.media-amazon.com/images/M/MV5BM2JjODdkMGMtNmY2YS00OGM2LThiY2YtZGYyNzE4Nzc2ODA0XkEyXkFqcGc@._V1_SX300.jpg,"[{'Source': 'Internet Movie Database', 'Value': '8.1/10'}, {'Source': 'Rotten Tomatoes', 'Value': '93%'}, {'Source': 'Metacritic', 'Value': '77/100'}]",77,8.1,"890,163",tt3315342,movie,N/A,"$226,277,068",N/A,N/A,True,
X-Men: Days of Future Past,2014,PG-13,23 May 2014,132 min,"Action, Adventure, Sci-Fi",Bryan Singer,"Simon Kinberg, Jane Goldman, Matthew Vaughn","Patrick Stewart, Ian McKellen, Hugh Jackman",The X-Men send Wolverine to the past in a desperate effort to change history and prevent an event that results in doom for both humans and mutants.,"English, Vietnamese, French","United Kingdom, United States, Canada",Nominated for 1 Oscar. 16 wins & 48 nominations total,https://m.media-amazon.com/images/M/MV5BNzNiYWE4NjMtMTU4OS00NmM4LWE4ZjAtYmE5OTA5NjkzODExXkEyXkFqcGc@._V1_SX300.jpg,"[{'Source': 'Internet Movie Database', 'Value': '7.9/10'}, {'Source': 'Rotten Tomatoes', 'Value': '90%'}, {'Source': 'Metacritic', 'Value': '75/100'}]",75,7.9,"764,434",tt1877832,movie,N/A,"$233,921,534",N/A,N/A,True,
X-Men: First Class,2011,PG-13,03 Jun 2011,131 min,"Action, Sci-Fi",Matthew Vaughn,"Ashley E. Miller, Zack Stentz, Jane Goldman","James McAvoy, Michael Fassbender, Jennifer Lawrence","In the 1960s, superpowered humans Charles Xavier and Erik Lensherr work together to find others like them, but Erik's vengeful pursuit of an ambitious mutant who ruined his life causes a schism to divide them.","English, German, French, Spanish, Russian","United States, United Kingdom",22 wins & 40 nominations total,https://m.media-amazon.com/images/M/MV5BMTg5OTMxNzk4Nl5BMl5BanBnXkFtZTcwOTk1MjAwNQ@@._V1_SX300.jpg,"[{'Source': 'Internet Movie Database', 'Value': '7.7/10'}, {'Source': 'Rotten Tomatoes', 'Value': '86%'}, {'Source': 'Metacritic', 'Value': '65/100'}]",65,7.7,"742,210",tt1270798,movie,N/A,"$146,408,305",N/A,N/A,True,
X-Men: Apocalypse,2016,PG-13,27 May 2016,144 min,"Action, Adventure, Sci-Fi",Bryan Singer,"Simon Kinberg, Bryan Singer, Michael Dougherty","James McAvoy, Michael Fassbender, Jennifer Lawrence","In the 1980s, the X-Men must defeat an ancient all-powerful mutant, En Sabah Nur, who intends to thrive by bringing destruction to the world.","English, Polish, German, Arabic, Egyptian (Ancient)",United States,1 win & 19 nominations total,https://m.media-amazon.com/images/M/MV5BNjVhNWY3NjItNmZjOS00NTU3LWFiZTctNzdjNGM5Y2Y0MDUwXkEyXkFqcGc@._V1_SX300.jpg,"[{'Source': 'Internet Movie Database', 'Value': '6.8/10'}, {'Source': 'Rotten Tomatoes', 'Value': '47%'}, {'Source': 'Metacritic', 'Value': '52/100'}]",52,6.8,"478,204",tt3385516,movie,N/A,"$155,442,489",N/A,N/A,True,
The Hunger Games,2012,PG-13,23 Mar 2012,142 min,"Action, Adventure, Sci-Fi",Gary Ross,"Gary Ross, Suzanne Collins, Billy Ray","Jennifer Lawrence, Josh Hutcherson, Liam Hemsworth",Katniss Everdeen voluntarily takes her younger sister's place in the Hunger Games: a televised competition in which two teenagers from each of the twelve Districts of Panem are chosen at random to fight to the death.,English,United States,Won 1 BAFTA Award34 wins & 49 nominations total,https://m.media-amazon.com/images/M/MV5BMWI1OGM4YjQtNmIxNi00YmE2LWJkNTAtY2Q0YjU4NTI5NWQyXkEyXkFqcGc@._V1_SX300.jpg,"[{'Source': 'Internet Movie Database', 'Value': '7.2/10'}, {'Source': 'Rotten Tomatoes', 'Value': '84%'}, {'Source': 'Metacritic', 'Value': '68/100'}]",68,7.2,"1,050,244",tt1392170,movie,N/A,"$408,010,692",N/A,N/A,True,
The Hunger Games: Catching Fire,2013,PG-13,22 Nov 2013,146 min,"Action, Adventure, Sci-Fi",Francis Lawrence,"Simon Beaufoy, Michael Arndt, Suzanne Collins","Jennifer Lawrence, Josh Hutcherson, Liam Hemsworth",Katniss Everdeen and Peeta Mellark become targets of the Capitol after their victory in the 74th Hunger Games sparks a rebellion in the Districts of Panem.,English,United States,22 wins & 68 nominations total,https://m.media-amazon.com/images/M/MV5BMTAyMjQ3OTAxMzNeQTJeQWpwZ15BbWU4MDU0NzA1MzAx._V1_SX300.jpg,"[{'Source': 'Internet Movie Database', 'Value': '7.5/10'}, {'Source': 'Rotten Tomatoes', 'Value': '90%'}, {'Source': 'Metacritic', 'Value': '76/100'}]",76,7.5,"750,609",tt1951264,movie,N/A,"$424,668,047",N/A,N/A,True,
The Hunger Games: Mockingjay - Part 1,2014,PG-13,21 Nov 2014,123 min,"Action, Adventure, Sci-Fi",Francis Lawrence,"Peter Craig, Danny Strong, Suzanne Collins","Jennifer Lawrence, Josh Hutcherson, Liam Hemsworth","Katniss Everdeen is in District 13 after she shatters the games forever. Under the leadership of President Coin and the advice of her trusted friends, Katniss spreads her wings as she fights to save Peeta and a nation moved by her...",English,"United States, Canada, France",21 wins & 32 nominations total,https://m.media-amazon.com/images/M/MV5BMTcxNDI2NDAzNl5BMl5BanBnXkFtZTgwODM3MTc2MjE@._V1_SX300.jpg,"[{'Source': 'Internet Movie Database', 'Value': '6.6/10'}, {'Source': 'Rotten Tomatoes', 'Value': '70%'}, {'Source': 'Metacritic', 'Value': '64/100'}]",64,6.6,"526,849",tt1951265,movie,N/A,"$337,135,885",N/A,N/A,True,
The Hunger Games: Mockingjay - Part 2,2015,PG-13,20 Nov 2015,137 min,"Action, Adventure, Sci-Fi",Francis Lawrence,"Peter Craig, Danny Strong, Suzanne Collins","Jennifer Lawrence, Josh Hutcherson, Liam Hemsworth",Katniss and a team of rebels from District 13 prepare for the final battle that will decide the fate of Panem.,English,"United States, Germany, Canada, France",15 wins & 34 nominations total,https://m.media-amazon.com/images/M/MV5BNjQzNDI2NTU1Ml5BMl5BanBnXkFtZTgwNTAyMDQ5NjE@._V1_SX300.jpg,"[{'Source': 'Internet Movie Database', 'Value': '6.6/10'}, {'Source': 'Rotten Tomatoes', 'Value': '70%'}, {'Source': 'Metacritic', 'Value': '65/100'}]",65,6.6,"396,665",tt1951266,movie,N/A,"$281,723,902",N/A,N/A,True,
Ready Player One,2018,PG-13,29 Mar 2018,140 min,"Action, Adventure, Sci-Fi",Steven Spielberg,"Zak Penn, Ernest Cline","Tye Sheridan, Olivia Cooke, Ben Mendelsohn","When the creator of a virtual reality called the OASIS dies, he makes a posthumous challenge to all OASIS users to find his Easter Egg, which will give the finder his fortune and control of his world.","English, Japanese","United States, India, Singapore, Canada, United Kingdom, Japan, Australia",Nominated for 1 Oscar. 11 wins & 57 nominations total,https://m.media-amazon.com/images/M/MV5BNzVkMTgzODQtMWIwZC00NzE4LTgzZjYtMzAwM2I5OGZhNjE4XkEyXkFqcGc@._V1_SX300.jpg,"[{'Source': 'Internet Movie Database', 'Value': '7.4/10'}, {'Source': 'Rotten Tomatoes', 'Value': '71%'}, {'Source': 'Metacritic', 'Value': '64/100'}]",64,7.4,"519,837",tt1677720,movie,N/A,"$137,715,350",N/A,N/A,True,
Bohemian Rhapsody,2018,PG-13,02 Nov 2018,134 min,"Biography, Drama, Music",Bryan Singer,"Anthony McCarten, Peter Morgan","Rami Malek, Lucy Boynton, Gwilym Lee","With his impeccable vocal abilities, Freddie Mercury and his rock band, Queen, achieve superstardom. However, amidst his skyrocketing success, he grapples with his ego, sexuality and a fatal illness.","English, British Sign ","United Kingdom, United States",Won 4 Oscars. 50 wins & 80 nominations total,https://m.media-amazon.com/images/M/MV5BMTA2NDc3Njg5NDVeQTJeQWpwZ15BbWU4MDc1NDcxNTUz._V1_SX300.jpg,"[{'Source': 'Internet Movie Database', 'Value': '7.9/10'}, {'Source': 'Rotten Tomatoes', 'Value': '60%'}, {'Source': 'Metacritic', 'Value': '49/100'}]",49,7.9,"624,662",tt1727824,movie,N/A,"$216,668,042",N/A,N/A,True,
Kung Fu Panda,2008,PG,06 Jun 2008,92 min,"Animation, Action, Adventure","Mark Osborne, John Stevenson","Jonathan Aibel, Glenn Berger, Ethan Reiff","Jack Black, Ian McShane, Angelina Jolie","To everyone's surprise, including his own, Po, an overweight, clumsy panda, is chosen as protector of the Valley of Peace. His suitability will soon be tested as the valley's arch-enemy is on his way.","English, Japanese, Chinese","United States, Japan, China, Russia",Nominated for 1 Oscar. 15 wins & 39 nominations total,https://m.media-amazon.com/images/M/MV5BZDU5MDNiMGItYjVmZi00NDUxLTg2OTktNGE0NzNlNzM4NzgyXkEyXkFqcGc@._V1_SX300.jpg,"[{'Source': 'Internet Movie Database', 'Value': '7.6/10'}, {'Source': 'Rotten Tomatoes', 'Value': '87%'}, {'Source': 'Metacritic', 'Value': '74/100'}]",74,7.6,"555,265",tt0441773,movie,N/A,"$216,064,546",N/A,N/A,True,
Kung Fu Panda 2,2011,PG,26 May 2011,90 min,"Animation, Action, Adventure",Jennifer Yuh Nelson,"Jonathan Aibel, Glenn Berger, Ethan Reiff","Jack Black, Angelina Jolie, Jackie Chan","Po and his friends fight to stop a peacock villain from conquering China with a deadly new weapon, but first the Dragon Warrior must come to terms with his past.",English,"United States, Canada",Nominated for 1 Oscar. 5 wins & 47 nominations total,https://m.media-amazon.com/images/M/MV5BYmIxMGYzMTUtZDQzYy00ODc4LWE1YzQtZGMwYTc0YTYyYTE0XkEyXkFqcGc@._V1_SX300.jpg,"[{'Source': 'Internet Movie Database', 'Value': '7.3/10'}, {'Source': 'Rotten Tomatoes', 'Value': '82%'}, {'Source': 'Metacritic', 'Value': '67/100'}]",67,7.3,"340,412",tt1302011,movie,N/A,"$165,249,063",N/A,N/A,True,
Kung Fu Panda 3,2016,PG,29 Jan 2016,95 min,"Animation, Action, Adventure","Alessandro Carloni, Jennifer Yuh Nelson","Jonathan Aibel, Glenn Berger, Ethan Reiff","Jack Black, Bryan Cranston, Dustin Hoffman","Continuing his ""legendary adventures of awesomeness"", Po must face two hugely epic, but different threats: one supernatural and the other a little closer to home.",English,"United States, China",1 win & 10 nominations total,https://m.media-amazon.com/images/M/MV5BMTUyNzgxNjg2M15BMl5BanBnXkFtZTgwMTY1NDI1NjE@._V1_SX300.jpg,"[{'Source': 'Internet Movie Database', 'Value': '7.1/10'}, {'Source': 'Rotten Tomatoes', 'Value': '87%'}, {'Source': 'Metacritic', 'Value': '66/100'}]",66,7.1,"206,750",tt2267968,movie,N/A,"$143,528,619",N/A,N/A,True,
Ice Age,2002,PG,15 Mar 2002,81 min,"Animation, Adventure, Comedy","Chris Wedge, Carlos Saldanha","Michael J. Wilson, Michael Berg, Peter Ackerman","Denis Leary, John Leguizamo, Ray Romano","Manny the mammoth, Sid the loquacious sloth, and Diego the sabre-toothed tiger go on a comical quest to return a human baby back to his father, across a world on the brink of an ice age.",English,United States,Nominated for 1 Oscar. 5 wins & 30 nominations total,https://m.media-amazon.com/images/M/MV5BMDBlYzU2OGMtOGJjNi00ZGZjLWIwNjMtYzdiZjkwYWNjZDljXkEyXkFqcGc@._V1_SX300.jpg,"[{'Source': 'Internet Movie Database', 'Value': '7.5/10'}, {'Source': 'Rotten Tomatoes', 'Value': '77%'}, {'Source': 'Metacritic', 'Value': '61/100'}]",61,7.5,"543,270",tt0268380,movie,N/A,"$176,387,405",N/A,N/A,True,
Madagascar,2005,PG,27 May 2005,86 min,"Animation, Adventure, Comedy","Eric Darnell, Tom McGrath","Mark Burton, Billy Frolick, Eric Darnell","Chris Rock, Ben Stiller, David Schwimmer","A group of animals who have spent all their life in a New York zoo end up in the jungles of Madagascar, and must adjust to living in the wild.","English, Portuguese, Spanish, German, French, American Sign ","United States, Canada, United Kingdom",4 wins & 32 nominations total,https://m.media-amazon.com/images/M/MV5BYjk4OGFmZmYtYWE4NC00MzM4LTkwZTItODdhMjk3NTZjMmI5XkEyXkFqcGc@._V1_SX300.jpg,"[{'Source': 'Internet Movie Database', 'Value': '6.9/10'}, {'Source': 'Rotten Tomatoes', 'Value': '55%'}, {'Source': 'Metacritic', 'Value': '57/100'}]",57,6.9,"462,313",tt0351283,movie,N/A,"$193,595,521",N/A,N/A,True,
Madagascar: Escape 2 Africa,2008,PG,07 Nov 2008,89 min,"Animation, Adventure, Comedy","Eric Darnell, Tom McGrath","Etan Cohen, Eric Darnell, Tom McGrath","Ben Stiller, Chris Rock, David Schwimmer","The Madagascar animals fly back to New York City, but crash-land on an African nature reserve in Kenya, where they meet others of their own kind, and Alex especially discovers his royal heritage as prince of a lion pride.",English,"United States, United Kingdom",4 wins & 11 nominations total,https://m.media-amazon.com/images/M/MV5BMjExMDA4NDcwMl5BMl5BanBnXkFtZTcwODAxNTQ3MQ@@._V1_SX300.jpg,"[{'Source': 'Internet Movie Database', 'Value': '6.6/10'}, {'Source': 'Rotten Tomatoes', 'Value': '64%'}, {'Source': 'Metacritic', 'Value': '61/100'}]",61,6.6,"260,830",tt0479952,movie,N/A,"$180,010,950",N/A,N/A,True,
Madagascar 3: Europe's Most Wanted,2012,PG,08 Jun 2012,93 min,"Animation, Adventure, Comedy","Eric Darnell, Tom McGrath, Conrad Vernon","Eric Darnell, Noah Baumbach, Alejandro Bien-Willner","Ben Stiller, Jada Pinkett Smith, Chris Rock","The Madagascar animals join a struggling European circus to get back to New York, but find themselves being pursued by a psychotic animal-control officer.","English, Spanish","United States, India, United Kingdom",3 wins & 20 nominations total,https://m.media-amazon.com/images/M/MV5BYTM5OWRiZTAtOTNkMS00NzNhLTkwYmYtMWI1MzkyMjE3MWE1XkEyXkFqcGc@._V1_SX300.jpg,"[{'Source': 'Internet Movie Database', 'Value': '6.8/10'}, {'Source': 'Rotten Tomatoes', 'Value': '78%'}, {'Source': 'Metacritic', 'Value': '60/100'}]",60,6.8,"208,827",tt1277953,movie,N/A,"$216,391,482",N/A,N/A,True,
Big Hero 6,2014,PG,07 Nov 2014,102 min,"Animation, Action, Adventure","Don Hall, Chris Williams","Jordan Roberts, Robert L. Baird, Daniel Gerson","Ryan Potter, Scott Adsit, Jamie Chung","A special bond develops between plus-sized inflatable robot Baymax and prodigy Hiro Hamada, who together team up with a group of friends to form a band of high-tech heroes.",English,United States,Won 1 Oscar. 17 wins & 58 nominations total,https://m.media-amazon.com/images/M/MV5BYjQ3YzUyOGQtNjdlYS00YmRhLWIyOWYtMGQ3YjkwMjJiYzRjXkEyXkFqcGc@._V1_SX300.jpg,"[{'Source': 'Internet Movie Database', 'Value': '7.8/10'}, {'Source': 'Rotten Tomatoes', 'Value': '90%'}, {'Source': 'Metacritic', 'Value': '74/100'}]",74,7.8,"531,564",tt2245084,movie,N/A,"$222,527,828",N/A,N/A,True,
Megamind,2010,PG,05 Nov 2010,95 min,"Animation, Action, Adventure",Tom McGrath,"Alan Schoolcraft, Brent Simons","Will Ferrell, Jonah Hill, Brad Pitt","Evil genius Megamind finally defeats his do-gooder nemesis, Metro Man, but is left without a purpose in a superhero-free world.",English,"United States, Australia",2 wins & 16 nominations total,https://m.media-amazon.com/images/M/MV5BMTAzMzI0NTMzNDBeQTJeQWpwZ15BbWU3MDM3NTAyOTM@._V1_SX300.jpg,"[{'Source': 'Internet Movie Database', 'Value': '7.3/10'}, {'Source': 'Rotten Tomatoes', 'Value': '73%'}, {'Source': 'Metacritic', 'Value': '63/100'}]",63,7.3,"309,985",tt1001526,movie,N/A,"$148,415,853",N/A,N/A,True,
Zootopia,2016,PG,04 Mar 2016,108 min,"Animation, Action, Adventure","Byron Howard, Rich Moore, Jared Bush","Byron Howard, Rich Moore, Jared Bush","Ginnifer Goodwin, Jason Bateman, Idris Elba","In a city of anthropomorphic animals, a rookie bunny cop and a cynical con artist fox must work together to uncover a conspiracy.",English,United States,Won 1 Oscar. 49 wins & 75 nominations total,https://m.media-amazon.com/images/M/MV5BOTMyMjEyNzIzMV5BMl5BanBnXkFtZTgwNzIyNjU0NzE@._V1_SX300.jpg,"[{'Source': 'Internet Movie Database', 'Value': '8.0/10'}, {'Source': 'Rotten Tomatoes', 'Value': '98%'}, {'Source': 'Metacritic', 'Value': '78/100'}]",78,8.0,"585,828",tt2948356,movie,N/A,"$341,268,248",N/A,N/A,True,
