
Star Wars: Episode I - The Phantom Menace,1999,PG,19 May 1999,136 min,"Action, Adventure, Fantasy",George Lucas,George Lucas,"Ewan McGregor, Liam Neeson, Natalie Portman","Two Jedi escape a hostile blockade to find allies and come across a young boy who may bring balance to the Force, but the long-dormant Sith resurface to claim their former glory.","English, Sanskrit","United States, United Kingdom",Nominated for 3 Oscars. 28 wins & 71 nominations total,https://m.media-amazon.com/images/M/MV5BODVhNGIxOGItYWNlMi00YTA0LWI3NTctZmQxZGUwZDEyZWI4XkEyXkFqcGc@._V1_SX300.jpg,"[{'Source': 'Internet Movie Database', 'Value': '6.5/10'}, {'Source': 'Rotten Tomatoes', 'Value': '54%'}, {'Source': 'Metacritic', 'Value': '51/100'}]",51,6.5,"895,208",tt0120915,movie,N/A,"$487,576,624",N/A,N/A,True,
Star Wars: Episode II - Attack of the Clones,2002,PG,16 May 2002,142 min,"Action, Adventure, Fantasy",George Lucas,"George Lucas, Jonathan Hales","Hayden Christensen, Natalie Portman, Ewan McGregor","Ten years after initially meeting, Anakin Skywalker shares a forbidden romance with Padmé Amidala, while Obi-Wan Kenobi discovers a secret clone army crafted for the Jedi.",English,"United States, United Kingdom",Nominated for 1 Oscar. 21 wins & 71 nominations total,https://m.media-amazon.com/images/M/MV5BNTgxMjY2YzUtZmVmNC00YjAwLWJlODMtNDBhNzllNzIzMjgxXkEyXkFqcGc@._V1_SX300.jpg,"[{'Source': 'Internet Movie Database', 'Value': '6.6/10'}, {'Source': 'Rotten Tomatoes', 'Value': '61%'}, {'Source': 'Metacritic', 'Value': '54/100'}]",54,6.6,"796,850",tt0121765,movie,N/A,"$310,676,740",N/A,N/A,True,
Star Wars: Episode III - Revenge of the Sith,2005,PG-13,19 May 2005,140 min,"Action, Adventure, Fantasy",George Lucas,George Lucas,"Hayden Christensen, Natalie Portman, Ewan McGregor","As the Clone Wars nears its end, Obi-Wan Kenobi pursues a new threat, while Anakin Skywalker is lured by Chancellor Palpatine into a sinister plot for galactic domination.",English,"United States, Italy, Switzerland, Thailand, United Kingdom",Nominated for 1 Oscar. 29 wins & 64 nominations total,https://m.media-amazon.com/images/M/MV5BNTc4MTc3NTQ5OF5BMl5BanBnXkFtZTcwOTg0NjI4NA@@._V1_SX300.jpg,"[{'Source': 'Internet Movie Database', 'Value': '7.6/10'}, {'Source': 'Rotten Tomatoes', 'Value': '79%'}, {'Source': 'Metacritic', 'Value': '68/100'}]",68,7.6,"888,346",tt0121766,movie,N/A,"$414,378,291",N/A,N/A,True,
Star Wars: Episode IV - A New Hope,1977,PG,25 May 1977,121 min,"Action, Adventure, Fantasy",George Lucas,George Lucas,"Mark Hamill, Harrison Ford, Carrie Fisher","Luke Skywalker joins forces with a Jedi Knight, a cocky pilot, a Wookiee and two droids to save the galaxy from the Empire's world-destroying battle station, while also attempting to rescue Princess Leia from the mysterious Darth ...",English,United States,Won 6 Oscars. 70 wins & 31 nominations total,https://m.media-amazon.com/images/M/MV5BOGUwMDk0Y2MtNjBlNi00NmRiLTk2MWYtMGMyMDlhYmI4ZDBjXkEyXkFqcGc@._V1_SX300.jpg,"[{'Source': 'Internet Movie Database', 'Value': '8.6/10'}, {'Source': 'Rotten Tomatoes', 'Value': '94%'}, {'Source': 'Metacritic', 'Value': '90/100'}]",90,8.6,"1,521,039",tt0076759,movie,N/A,"$460,998,507",N/A,N/A,True,
Star Wars: Episode V - The Empire Strikes Back,1980,PG,18 Jun 1980,124 min,"Action, Adventure, Fantasy",Irvin Kershner,"Leigh Brackett, Lawrence Kasdan, George Lucas","Mark Hamill, Harrison Ford, Carrie Fisher","After the Empire overpowers the Rebel Alliance, Luke Skywalker begins training with Jedi Master Yoda, while Darth Vader and bounty hunter Boba Fett pursue his friends across the galaxy.",English,United States,Won 1 Oscar. 27 wins & 21 nominations total,https://m.media-amazon.com/images/M/MV5BMTkxNGFlNDktZmJkNC00MDdhLTg0MTEtZjZiYWI3MGE5NWIwXkEyXkFqcGc@._V1_SX300.jpg,"[{'Source': 'Internet Movie Database', 'Value': '8.7/10'}, {'Source': 'Rotten Tomatoes', 'Value': '93%'}, {'Source': 'Metacritic', 'Value': '82/100'}]",82,8.7,"1,454,664",tt0080684,movie,N/A,"$292,753,960",N/A,N/A,True,
Star Wars: Episode VI - Return of the Jedi,1983,PG,25 May 1983,131 min,"Action, Adventure, Fantasy",Richard Marquand,"Lawrence Kasdan, George Lucas","Mark Hamill, Harrison Ford, Carrie Fisher","After rescuing Han Solo from Jabba the Hutt, the Rebel Alliance attempts to destroy the second Death Star while Luke struggles to help Darth Vader back from the dark side.","English, Kikuyu, Tagalog, Kalmyk-Oirat, Quechua, Polish",United States,Nominated for 4 Oscars. 25 wins & 23 nominations total,https://m.media-amazon.com/images/M/MV5BNWEwOTI0MmUtMGNmNy00ODViLTlkZDQtZTg1YmQ3MDgyNTUzXkEyXkFqcGc@._V1_SX300.jpg,"[{'Source': 'Internet Movie Database', 'Value': '8.3/10'}, {'Source': 'Rotten Tomatoes', 'Value': '83%'}, {'Source': 'Metacritic', 'Value': '58/100'}]",58,8.3,"1,174,194",tt0086190,movie,N/A,"$316,566,101",N/A,N/A,True,
The Lord of the Rings: The Fellowship of the Ring,2001,PG-13,19 Dec 2001,178 min,"Adventure, Drama, Fantasy",Peter Jackson,"J.R.R. Tolkien, Fran Walsh, Philippa Boyens","Elijah Wood, Ian McKellen, Orlando Bloom",A meek Hobbit from the Shire and eight companions set out on a journey to destroy the powerful One Ring and save Middle-earth from the Dark Lord Sauron.,"English, Sindarin","New Zealand, United States, United Kingdom",Won 4 Oscars. 125 wins & 126 nominations total,https://m.media-amazon.com/images/M/MV5BNzIxMDQ2YTctNDY4MC00ZTRhLTk4ODQtMTVlOWY4NTdiYmMwXkEyXkFqcGc@._V1_SX300.jpg,"[{'Source': 'Internet Movie Database', 'Value': '8.9/10'}, {'Source': 'Rotten Tomatoes', 'Value': '92%'}, {'Source': 'Metacritic', 'Value': '92/100'}]",92,8.9,"2,124,156",tt0120737,movie,N/A,"$319,372,078",N/A,N/A,True,
The Lord of the Rings: The Two Towers,2002,PG-13,18 Dec 2002,179 min,"Adventure, Drama, Fantasy",Peter Jackson,"J.R.R. Tolkien, Fran Walsh, Philippa Boyens","Elijah Wood, Ian McKellen, Viggo Mortensen","While Frodo and Sam edge closer to Mordor with the help of the shifty Gollum, the divided fellowship makes a stand against Sauron's new ally, Saruman, and his hordes of Isengard.","English, Sindarin, Old English","New Zealand, United States",Won 2 Oscars. 132 wins & 138 nominations total,https://m.media-amazon.com/images/M/MV5BMGQxMDdiOWUtYjc1Ni00YzM1LWE2NjMtZTg3Y2JkMjEzMTJjXkEyXkFqcGc@._V1_SX300.jpg,"[{'Source': 'Internet Movie Database', 'Value': '8.8/10'}, {'Source': 'Rotten Tomatoes', 'Value': '95%'}, {'Source': 'Metacritic', 'Value': '87/100'}]",87,8.8,"1,881,081",tt0167261,movie,N/A,"$345,518,923",N/A,N/A,True,
The Lord of the Rings: The Return of the King,2003,PG-13,17 Dec 2003,201 min,"Adventure, Drama, Fantasy",Peter Jackson,"J.R.R. Tolkien, Fran Walsh, Philippa Boyens","Elijah Wood, Viggo Mortensen, Ian McKellen",Gandalf and Aragorn lead the World of Men against Sauron's army to draw his gaze from Frodo and Sam as they approach Mount Doom with the One Ring.,"English, Quenya, Old English, Sindarin","New Zealand, United States",Won 11 Oscars. 215 wins & 124 nominations total,https://m.media-amazon.com/images/M/MV5BMTZkMjBjNWMtZGI5OC00MGU0LTk4ZTItODg2NWM3NTVmNWQ4XkEyXkFqcGc@._V1_SX300.jpg,"[{'Source': 'Internet Movie Database', 'Value': '9.0/10'}, {'Source': 'Rotten Tomatoes', 'Value': '94%'}, {'Source': 'Metacritic', 'Value': '94/100'}]",94,9.0,"2,092,328",tt0167260,movie,N/A,"$381,878,219",N/A,N/A,True,
Harry Potter and the Sorcerer's Stone,2001,PG,16 Nov 2001,152 min,"Adventure, Family, Fantasy",Chris Columbus,"J.K. Rowling, Steve Kloves","Daniel Radcliffe, Rupert Grint, Emma Watson","An orphaned boy enrolls in a school of wizardry, where he learns the truth about himself, his family and the terrible evil that haunts the magical world.","English, Latin","United Kingdom, United States",Nominated for 3 Oscars. 20 wins & 74 nominations total,https://m.media-amazon.com/images/M/MV5BNTU1MzgyMDMtMzBlZS00YzczLThmYWEtMjU3YmFlOWEyMjE1XkEyXkFqcGc@._V1_SX300.jpg,"[{'Source': 'Internet Movie Database', 'Value': '7.7/10'}, {'Source': 'Rotten Tomatoes', 'Value': '80%'}, {'Source': 'Metacritic', 'Value': '65/100'}]",65,7.7,"910,741",tt0241527,movie,N/A,"$318,886,962",N/A,N/A,True,
Harry Potter and the Chamber of Secrets,2002,PG,15 Nov 2002,161 min,"Adventure, Family, Fantasy",Chris Columbus,"J.K. Rowling, Steve Kloves","Daniel Radcliffe, Rupert Grint, Emma Watson","Harry Potter lives his second year at Hogwarts with Ron and Hermione when a message on the wall announces that the legendary Chamber of Secrets has been opened. The trio soon realize that, to save the school, it will take a lot of...","English, Latin","United Kingdom, United States",Won 1 BAFTA Award14 wins & 50 nominations total,https://m.media-amazon.com/images/M/MV5BNGJhM2M2MWYtZjIzMC00MDZmLThkY2EtOWViMDhhYjRhMzk4XkEyXkFqcGc@._V1_SX300.jpg,"[{'Source': 'Internet Movie Database', 'Value': '7.5/10'}, {'Source': 'Rotten Tomatoes', 'Value': '82%'}, {'Source': 'Metacritic', 'Value': '63/100'}]",63,7.5,"735,500",tt0295297,movie,N/A,"$262,641,637",N/A,N/A,True,
Harry Potter and the Prisoner of Azkaban,2004,PG,04 Jun 2004,142 min,"Adventure, Family, Fantasy",Alfonso Cuarón,"J.K. Rowling, Steve Kloves","Daniel Radcliffe, Emma Watson, Rupert Grint","Harry Potter, Ron and Hermione return to Hogwarts School of Witchcraft and Wizardry for their third year of study, where they delve into the mystery surrounding an escaped prisoner who poses a dangerous threat to the young wizard.","English, Latin, Old English","United Kingdom, United States",Nominated for 2 Oscars. 17 wins & 56 nominations total,https://m.media-amazon.com/images/M/MV5BMTY4NTIwODg0N15BMl5BanBnXkFtZTcwOTc0MjEzMw@@._V1_SX300.jpg,"[{'Source': 'Internet Movie Database', 'Value': '7.9/10'}, {'Source': 'Rotten Tomatoes', 'Value': '91%'}, {'Source': 'Metacritic', 'Value': '82/100'}]",82,7.9,"734,790",tt0304141,movie,N/A,"$250,105,651",N/A,N/A,True,
Harry Potter and the Goblet of Fire,2005,PG-13,18 Nov 2005,157 min,"Adventure, Family, Fantasy",Mike Newell,"Steve Kloves, J.K. Rowling","Daniel Radcliffe, Emma Watson, Rupert Grint","Harry Potter finds himself competing in a hazardous tournament between rival schools of magic, but he is distracted by recurring nightmares.","English, French, Latin","United Kingdom, United States",Nominated for 1 Oscar. 13 wins & 48 nominations total,https://m.media-amazon.com/images/M/MV5BMTI1NDMyMjExOF5BMl5BanBnXkFtZTcwOTc4MjQzMQ@@._V1_SX300.jpg,"[{'Source': 'Internet Movie Database', 'Value': '7.7/10'}, {'Source': 'Rotten Tomatoes', 'Value': '88%'}, {'Source': 'Metacritic', 'Value': '81/100'}]",81,7.7,"719,576",tt0330373,movie,N/A,"$290,469,928",N/A,N/A,True,
Harry Potter and the Order of the Phoenix,2007,PG-13,11 Jul 2007,138 min,"Action, Adventure, Family",David Yates,"Michael Goldenberg, J.K. Rowling","Daniel Radcliffe, Emma Watson, Rupert Grint","With their warning about Lord Voldemort's return scoffed at, Harry and Dumbledore are targeted by the Wizard authorities as an authoritarian bureaucrat slowly seizes power at Hogwarts.","English, Latin","United Kingdom, United States",Nominated for 2 BAFTA 17 wins & 50 nominations total,https://m.media-amazon.com/images/M/MV5BYWJmM2M1YzItMjY1Ni00YzRmLTg5YWYtNDFmNTJjNzQ0ODkyXkEyXkFqcGc@._V1_SX300.jpg,"[{'Source': 'Internet Movie Database', 'Value': '7.5/10'}, {'Source': 'Rotten Tomatoes', 'Value': '78%'}, {'Source': 'Metacritic', 'Value': '71/100'}]",71,7.5,"671,556",tt0373889,movie,N/A,"$292,382,727",N/A,N/A,True,
Harry Potter and the Half-Blood Prince,2009,PG,15 Jul 2009,153 min,"Action, Adventure, Family",David Yates,"Steve Kloves, J.K. Rowling","Daniel Radcliffe, Emma Watson, Rupert Grint","As Harry Potter begins his sixth year at Hogwarts, he discovers an old book marked as ""the property of the Half-Blood Prince"" and begins to learn more about Lord Voldemort's dark past.","English, Latin","United Kingdom, United States",Nominated for 1 Oscar. 9 wins & 39 nominations total,https://m.media-amazon.com/images/M/MV5BNzU3NDg4NTAyNV5BMl5BanBnXkFtZTcwOTg2ODg1Mg@@._V1_SX300.jpg,"[{'Source': 'Internet Movie Database', 'Value': '7.6/10'}, {'Source': 'Rotten Tomatoes', 'Value': '83%'}, {'Source': 'Metacritic', 'Value': '78/100'}]",78,7.6,"629,640",tt0417741,movie,N/A,"$302,334,374",N/A,N/A,True,
Harry Potter and the Deathly Hallows: Part 1,2010,PG-13,19 Nov 2010,146 min,"Adventure, Family, Fantasy",David Yates,"Steve Kloves, J.K. Rowling","Daniel Radcliffe, Emma Watson, Rupert Grint","Harry Potter is tasked with the dangerous and seemingly impossible task of locating and destroying Voldemort's remaining Horcruxes. Harry must rely on Ron and Hermione more than ever, but dark forces threaten to tear them apart.","English, Latin","United Kingdom, United States",Nominated for 2 Oscars. 15 wins & 55 nominations total,https://m.media-amazon.com/images/M/MV5BMTQ2OTE1Mjk0N15BMl5BanBnXkFtZTcwODE3MDAwNA@@._V1_SX300.jpg,"[{'Source': 'Internet Movie Database', 'Value': '7.7/10'}, {'Source': 'Rotten Tomatoes', 'Value': '76%'}, {'Source': 'Metacritic', 'Value': '65/100'}]",65,7.7,"633,805",tt0926084,movie,N/A,"$296,374,621",N/A,N/A,True,
The Simpsons Movie,2007,PG-13,27 Jul 2007,87 min,"Animation, Adventure, Comedy",David Silverman,"James L. Brooks, Matt Groening, Al Jean","Dan Castellaneta, Julie Kavner, Nancy Cartwright","After Homer pollutes the town's water supply, Springfield is encased in a gigantic dome by the EPA and the Simpsons are declared fugitives.",English,United States,Won 1 BAFTA Award5 wins & 34 nominations total,https://m.media-amazon.com/images/M/MV5BMzIxN2IzOGItOTcyZi00MTkzLWE4ZjktZTdlOWFiYWE4NzlmXkEyXkFqcGc@._V1_SX300.jpg,"[{'Source': 'Internet Movie Database', 'Value': '7.3/10'}, {'Source': 'Rotten Tomatoes', 'Value': '87%'}, {'Source': 'Metacritic', 'Value': '80/100'}]",80,7.3,"358,052",tt0462538,movie,N/A,"$183,135,014",N/A,N/A,True,
The Simpsons,1989–,TV-14,17 Dec 1989,22 min,"Animation, Comedy",N/A,"James L. Brooks, Matt Groening, Sam Simon","Dan Castellaneta, Nancy Cartwright, Julie Kavner",The satiric half-hour adventures of a working-class family in the misfit city of Springfield.,English,United States,Won 37 Primetime Emmys. 187 wins & 373 nominations total,https://m.media-amazon.com/images/M/MV5BNTU2OWE0YWYtMjRlMS00NTUwLWJmZWUtODFhNzJiMGJlMzI3XkEyXkFqcGc@._V1_SX300.jpg,"[{'Source': 'Internet Movie Database', 'Value': '8.6/10'}, {'Source': 'Rotten Tomatoes', 'Value': '85%'}]",N/A,8.6,"455,103",tt0096697,series,,,,,True,36
Toy Story,1995,G,22 Nov 1995,81 min,"Animation, Adventure, Comedy",John Lasseter,"John Lasseter, Pete Docter, Andrew Stanton","Tom Hanks, Tim Allen, Don Rickles","A cowboy doll is profoundly jealous when a new spaceman action figure supplants him as the top toy in a boy's bedroom. When circumstances separate them from their owner, the duo have to put aside their differences to return to him.",English,United States,Nominated for 3 Oscars. 29 wins & 24 nominations total,https://m.media-amazon.com/images/M/MV5BZTA3OWVjOWItNjE1NS00NzZiLWE1MjgtZDZhMWI1ZTlkNzYwXkEyXkFqcGc@._V1_SX300.jpg,"[{'Source': 'Internet Movie Database', 'Value': '8.3/10'}, {'Source': 'Rotten Tomatoes', 'Value': '100%'}, {'Source': 'Metacritic', 'Value': '96/100'}]",96,8.3,"1,131,543",tt0114709,movie,N/A,"$223,225,679",N/A,N/A,True,
Toy Story 2,1999,G,24 Nov 1999,92 min,"Animation, Adventure, Comedy","John Lasseter, Ash Brannon, Lee Unkrich","John Lasseter, Pete Docter, Ash Brannon","Tom Hanks, Tim Allen, Joan Cusack","When Woody is stolen by a toy collector, Buzz and his friends set out on a rescue mission to save Woody before he becomes a museum toy property with his roundup gang Jessie, Prospector, and Bullseye.",English,United States,Nominated for 1 Oscar. 21 wins & 27 nominations total,https://m.media-amazon.com/images/M/MV5BNzVmODlhMDEtY2YxZi00OTVjLTlkNTktN2Q2OTRlM2I4M2FhXkEyXkFqcGc@._V1_SX300.jpg,"[{'Source': 'Internet Movie Database', 'Value': '7.9/10'}, {'Source': 'Rotten Tomatoes', 'Value': '100%'}, {'Source': 'Metacritic', 'Value': '88/100'}]",88,7.9,"648,848",tt0120363,movie,N/A,"$245,852,179",N/A,N/A,True,
Toy Story 3,2010,G,18 Jun 2010,103 min,"Animation, Adventure, Comedy",Lee Unkrich,"John Lasseter, Andrew Stanton, Lee Unkrich","Tom Hanks, Tim Allen, Joan Cusack","The toys are mistakenly delivered to a day-care center instead of the attic right before Andy leaves for college, and it's up to Woody to convince the other toys that they weren't abandoned and to return home.","English, Spanish",United States,Won 2 Oscars. 63 wins & 96 nominations total,https://m.media-amazon.com/images/M/MV5BMTgxOTY4Mjc0MF5BMl5BanBnXkFtZTcwNTA4MDQyMw@@._V1_SX300.jpg,"[{'Source': 'Internet Movie Database', 'Value': '8.3/10'}, {'Source': 'Rotten Tomatoes', 'Value': '98%'}, {'Source': 'Metacritic', 'Value': '92/100'}]",92,8.3,"935,364",tt0435761,movie,N/A,"$415,004,880",N/A,N/A,True,
"Monsters, Inc.",2001,G,23 Nov 2001,92 min,"Animation, Adventure, Comedy","Pete Docter, David Silverman, Lee Unkrich","Pete Docter, Jill Culton, Jeff Pidgeon","Billy Crystal, John Goodman, Mary Gibbs","In order to power the city, monsters have to scare children so that they scream. However, the children are toxic to the monsters, and after a child gets through, two monsters realize things may not be what they think.",English,United States,Won 1 Oscar. 15 wins & 38 nominations total,https://m.media-amazon.com/images/M/MV5BMTY1NTI0ODUyOF5BMl5BanBnXkFtZTgwNTEyNjQ0MDE@._V1_SX300.jpg,"[{'Source': 'Internet Movie Database', 'Value': '8.1/10'}, {'Source': 'Rotten Tomatoes', 'Value': '96%'}, {'Source': 'Metacritic', 'Value': '79/100'}]",79,8.1,"1,031,766",tt0198781,movie,N/A,"$290,642,256",N/A,N/A,True,
Finding Nemo,2003,G,30 May 2003,100 min,"Animation, Adventure, Comedy","Andrew Stanton, Lee Unkrich","Andrew Stanton, Bob Peterson, David Reynolds","Albert Brooks, Ellen DeGeneres, Alexander Gould","After his son is captured in the Great Barrier Reef and taken to Sydney, a timid clownfish sets out on a journey to bring him home.","English, Japanese, Russian","United States, Japan, Australia",Won 1 Oscar. 49 wins & 63 nominations total,https://m.media-amazon.com/images/M/MV5BMTc5NjExNTA5OV5BMl5BanBnXkFtZTYwMTQ0ODY2._V1_SX300.jpg,"[{'Source': 'Internet Movie Database', 'Value': '8.2/10'}, {'Source': 'Rotten Tomatoes', 'Value': '99%'}, {'Source': 'Metacritic', 'Value': '90/100'}]",90,8.2,"1,164,450",tt0266543,movie,N/A,"$380,843,261",N/A,N/A,True,
The Incredibles,2004,PG,05 Nov 2004,115 min,"Animation, Action, Adventure",Brad Bird,Brad Bird,"Craig T. Nelson, Samuel L. Jackson, Holly Hunter","While trying to lead a quiet suburban life, a family of undercover superheroes are forced into action to save the world.","English, French, German, Italian, Portuguese, Russian",United States,Won 2 Oscars. 69 wins & 56 nominations total,https://m.media-amazon.com/images/M/MV5BMTY5OTU0OTc2NV5BMl5BanBnXkFtZTcwMzU4MDcyMQ@@._V1_SX300.jpg,"[{'Source': 'Internet Movie Database', 'Value': '8.0/10'}, {'Source': 'Metacritic', 'Value': '90/100'}]",90,8.0,"855,560",tt0317705,movie,29 Mar 2005,"$261,441,092",N/A,N/A,True,
Ratatouille,2007,G,29 Jun 2007,111 min,"Animation, Adventure, Comedy","Brad Bird, Jan Pinkava","Brad Bird, Jan Pinkava, Jim Capobianco","Brad Garrett, Lou Romano, Patton Oswalt",A rat who can cook makes an unusual alliance with a young kitchen worker at a famous Paris restaurant.,"English, French",United States,Won 1 Oscar. 68 wins & 42 nominations total,https://m.media-amazon.com/images/M/MV5BMTMzODU0NTkxMF5BMl5BanBnXkFtZTcwMjQ4MzMzMw@@._V1_SX300.jpg,"[{'Source': 'Internet Movie Database', 'Value': '8.1/10'}, {'Source': 'Rotten Tomatoes', 'Value': '96%'}, {'Source': 'Metacritic', 'Value': '96/100'}]",96,8.1,"890,294",tt0382932,movie,N/A,"$206,445,654",N/A,N/A,True,
WALL·E,2008,G,27 Jun 2008,98 min,"Animation, Adventure, Family",Andrew Stanton,"Andrew Stanton, Pete Docter, Jim Reardon","Ben Burtt, Elissa Knight, Jeff Garlin","A robot who is responsible for cleaning a waste-covered Earth meets another robot and falls in love with her. Together, they set out on a journey that will alter the fate of mankind.",English,"United States, Japan",Won 1 Oscar. 96 wins & 95 nominations total,https://m.media-amazon.com/images/M/MV5BMjExMTg5OTU0NF5BMl5BanBnXkFtZTcwMjMxMzMzMw@@._V1_SX300.jpg,"[{'Source': 'Internet Movie Database', 'Value': '8.4/10'}, {'Source': 'Rotten Tomatoes', 'Value': '95%'}, {'Source': 'Metacritic', 'Value': '95/100'}]",95,8.4,"1,265,242",tt0910970,movie,N/A,"$223,808,164",N/A,N/A,True,
Up,2009,PG,23 Jul 2009,96 min,"Animation, Adventure, Comedy","Pete Docter, Bob Peterson","Pete Docter, Bob Peterson, Tom McCarthy","Edward Asner, Jordan Nagai, John Ratzenberger","78-year-old Carl Fredricksen travels to South America in his house equipped with balloons, inadvertently taking a young stowaway.",English,United States,Won 2 Oscars. 81 wins & 88 nominations total,https://m.media-amazon.com/images/M/MV5BNmI1ZTc5MWMtMDYyOS00ZDc2LTkzOTAtNjQ4NWIxNjYyNDgzXkEyXkFqcGc@._V1_SX300.jpg,"[{'Source': 'Internet Movie Database', 'Value': '8.3/10'}, {'Source': 'Rotten Tomatoes', 'Value': '98%'}, {'Source': 'Metacritic', 'Value': '88/100'}]",88,8.3,"1,185,278",tt1049413,movie,N/A,"$293,004,164",N/A,N/A,True,
Coco,2017,PG,22 Nov 2017,105 min,"Animation, Adventure, Drama","Lee Unkrich, Adrian Molina","Lee Unkrich, Jason Katz, Matthew Aldrich","Anthony Gonzalez, Gael García Bernal, Benjamin Bratt","Aspiring musician Miguel, confronted with his family's ancestral ban on music, enters the Land of the Dead to find his great-great-grandfather, a legendary singer.","English, Spanish","United States, Mexico",Won 2 Oscars. 112 wins & 42 nominations total,https://m.media-amazon.com/images/M/MV5BMDIyM2E2NTAtMzlhNy00ZGUxLWI1NjgtZDY5MzhiMDc5NGU3XkEyXkFqcGc@._V1_SX300.jpg,"[{'Source': 'Internet Movie Database', 'Value': '8.4/10'}, {'Source': 'Rotten Tomatoes', 'Value': '97%'}, {'Source': 'Metacritic', 'Value': '81/100'}]",81,8.4,"659,069",tt2380307,movie,N/A,"$210,460,015",N/A,N/A,True,
Inside Out,2015,PG,19 Jun 2015,95 min,"Animation, Adventure, Comedy","Pete Docter, Ronnie Del Carmen","Pete Docter, Ronnie Del Carmen, Meg LeFauve","Amy Poehler, Bill Hader, Lewis Black","After young Riley is uprooted from her Midwest life and moved to San Francisco, her emotions - Joy, Fear, Anger, Disgust and Sadness - conflict on how best to navigate a new city, house, and school.","English, Portuguese, Latvian",United States,Won 1 Oscar. 99 wins & 118 nominations total,https://m.media-amazon.com/images/M/MV5BOTgxMDQwMDk0OF5BMl5BanBnXkFtZTgwNjU5OTg2NDE@._V1_SX300.jpg,"[{'Source': 'Internet Movie Database', 'Value': '8.1/10'}, {'Source': 'Rotten Tomatoes', 'Value': '98%'}, {'Source': 'Metacritic', 'Value': '94/100'}]",94,8.1,"870,382",tt2096673,movie,N/A,"$356,461,711",N/A,N/A,True,
Soul,2020,PG,29 Nov 2020,100 min,"Animation, Adventure, Comedy","Pete Docter, Kemp Powers","Pete Docter, Mike Jones, Kemp Powers","Jamie Foxx, Tina Fey, Graham Norton","Joe is a middle-school band teacher whose life hasn't quite gone the way he expected. His true passion is jazz. But when he travels to another realm to help someone find their passion, he soon discovers what it means to have soul.","English, Korean, Inuktitut",United States,Won 2 Oscars. 124 wins & 91 nominations total,https://m.media-amazon.com/images/M/MV5BZTZkYjA5MDEtMjY1ZC00ODk5LThjOTUtZDYxODEzYWNjMTU2XkEyXkFqcGc@._V1_SX300.jpg,"[{'Source': 'Internet Movie Database', 'Value': '8.0/10'}, {'Source': 'Rotten Tomatoes', 'Value': '95%'}, {'Source': 'Metacritic', 'Value': '83/100'}]",83,8.0,"412,080",tt2948372,movie,N/A,"$946,154",N/A,N/A,True,
Cars,2006,G,09 Jun 2006,116 min,"Animation, Adventure, Comedy","John Lasseter, Joe Ranft","John Lasseter, Joe Ranft, Jorgen Klubien","Owen Wilson, Bonnie Hunt, Paul Newman","On the way to the biggest race of his life, a hotshot rookie race car gets stranded in a rundown town and learns that winning isn't everything in life.","English, Italian, Japanese, Yiddish",United States,Nominated for 2 Oscars. 28 wins & 34 nominations total,https://m.media-amazon.com/images/M/MV5BMTg5NzY0MzA2MV5BMl5BanBnXkFtZTYwNDc3NTc2._V1_SX300.jpg,"[{'Source': 'Internet Movie Database', 'Value': '7.3/10'}, {'Source': 'Rotten Tomatoes', 'Value': '74%'}, {'Source': 'Metacritic', 'Value': '73/100'}]",73,7.3,"506,040",tt0317219,movie,N/A,"$244,082,982",N/A,N/A,True,
Cars 2,2011,G,24 Jun 2011,106 min,"Animation, Adventure, Comedy","John Lasseter, Bradford Lewis","John Lasseter, Bradford Lewis, Dan Fogelman","Owen Wilson, Larry the Cable Guy, Michael Caine",Star race car Lightning McQueen and his pal Mater head overseas to compete in the World Grand Prix race. But the road to the championship becomes rocky as Mater gets caught up in an intriguing adventure of his own: international e...,"English, Japanese, Italian, French, Russian","United States, Japan, India, United Kingdom",1 win & 19 nominations total,https://m.media-amazon.com/images/M/MV5BMTUzNTc3MTU3M15BMl5BanBnXkFtZTcwMzIxNTc3NA@@._V1_SX300.jpg,"[{'Source': 'Internet Movie Database', 'Value': '6.2/10'}, {'Source': 'Rotten Tomatoes', 'Value': '40%'}, {'Source': 'Metacritic', 'Value': '57/100'}]",57,6.2,"240,276",tt1216475,movie,N/A,"$191,452,396",N/A,N/A,True,
Brave,2012,PG,22 Jun 2012,93 min,"Animation, Action, Adventure","Mark Andrews, Brenda Chapman, Steve Purcell","Brenda Chapman, Mark Andrews, Steve Purcell","Kelly Macdonald, Billy Connolly, Emma Thompson","Determined to make her own path in life, Princess Merida defies a custom that brings chaos to her kingdom. Granted one wish, Merida must rely on her bravery and her archery skills to undo a beastly curse.",English,"United States, Japan, United Kingdom",Won 1 Oscar. 20 wins & 48 nominations total,https://m.media-amazon.com/images/M/MV5BMzgwODk3ODA1NF5BMl5BanBnXkFtZTcwNjU3NjQ0Nw@@._V1_SX300.jpg,"[{'Source': 'Internet Movie Database', 'Value': '7.1/10'}, {'Source': 'Rotten Tomatoes', 'Value': '78%'}, {'Source': 'Metacritic', 'Value': '69/100'}]",69,7.1,"464,856",tt1217209,movie,N/A,"$237,283,207",N/A,N/A,True,
