Title,Year,Rated,Released,Runtime,Genre,Director,Writer,Actors,Plot,Language,Country,Awards,Poster,Ratings,Metascore,imdbRating,imdbVotes,imdbID,Type,DVD,BoxOffice,Production,Website,Response,totalSeasons
Harry Potter and the Deathly Hallows: Part 1,2010,PG-13,19 Nov 2010,146 min,"Adventure, Family, Fantasy",David Yates,"Steve Kloves, J.K. Rowling","Daniel Radcliffe, Emma Watson, Rupert Grint","Harry Potter is tasked with the dangerous and seemingly impossible task of locating and destroying Voldemort's remaining Horcruxes. Harry must rely on Ron and Hermione more than ever, but dark forces threaten to tear them apart.","English, Latin","United Kingdom, United States",Nominated for 2 Oscars. 15 wins & 55 nominations total,https://m.media-amazon.com/images/M/MV5BMTQ2OTE1Mjk0N15BMl5BanBnXkFtZTcwODE3MDAwNA@@._V1_SX300.jpg,"[{'Source': 'Internet Movie Database', 'Value': '7.7/10'}, {'Source': 'Rotten Tomatoes', 'Value': '76%'}, {'Source': 'Metacritic', 'Value': '65/100'}]",65,7.7,"636,901",tt0926084,movie,N/A,"$296,374,621",N/A,N/A,True,
Harry Potter and the Deathly Hallows: Part 2,2011,PG-13,15 Jul 2011,130 min,"Adventure, Family, Fantasy",David Yates,"Steve Kloves, J.K. Rowling","Daniel Radcliffe, Emma Watson, Rupert Grint","As the battle between the forces of good and evil in the wizarding world escalates, Harry Potter draws ever closer to his final confrontation with Voldemort.","English, Latin","United Kingdom, United States",Nominated for 3 Oscars. 49 wins & 96 nominations total,https://m.media-amazon.com/images/M/MV5BOTA1Mzc2N2ItZWRiNS00MjQzLTlmZDQtMjU0NmY1YWRkMGQ4XkEyXkFqcGc@._V1_SX300.jpg,"[{'Source': 'Internet Movie Database', 'Value': '8.1/10'}, {'Source': 'Rotten Tomatoes', 'Value': '96%'}, {'Source': 'Metacritic', 'Value': '85/100'}]",85,8.1,"1,000,668",tt1201607,movie,N/A,"$381,447,587",N/A,N/A,True,
Inception,2010,PG-13,16 Jul 2010,148 min,"Action, Adventure, Sci-Fi",Christopher Nolan,Christopher Nolan,"Leonardo DiCaprio, Joseph Gordon-Levitt, Elliot Page","A thief who steals corporate secrets through the use of dream-sharing technology is given the inverse task of planting an idea into the mind of a C.E.O., but his tragic past may doom the project and his team to disaster.","English, Japanese, French","United States, United Kingdom",Won 4 Oscars. 159 wins & 220 nominations total,https://m.media-amazon.com/images/M/MV5BMjAxMzY3NjcxNF5BMl5BanBnXkFtZTcwNTI5OTM0Mw@@._V1_SX300.jpg,"[{'Source': 'Internet Movie Database', 'Value': '8.8/10'}, {'Source': 'Rotten Tomatoes', 'Value': '87%'}, {'Source': 'Metacritic', 'Value': '74/100'}]",74,8.8,"2,705,756",tt1375666,movie,N/A,"$292,587,330",N/A,N/A,True,
The Dark Knight,2008,PG-13,18 Jul 2008,152 min,"Action, Crime, Drama",Christopher Nolan,"Jonathan Nolan, Christopher Nolan, David S. Goyer","Christian Bale, Heath Ledger, Aaron Eckhart","When a menace known as the Joker wreaks havoc and chaos on the people of Gotham, Batman, James Gordon and Harvey Dent must work together to put an end to the madness.","English, Mandarin","United States, United Kingdom",Won 2 Oscars. 163 wins & 165 nominations total,https://m.media-amazon.com/images/M/MV5BMTMxNTMwODM0NF5BMl5BanBnXkFtZTcwODAyMTk2Mw@@._V1_SX300.jpg,"[{'Source': 'Internet Movie Database', 'Value': '9.0/10'}, {'Source': 'Rotten Tomatoes', 'Value': '94%'}, {'Source': 'Metacritic', 'Value': '85/100'}]",85,9.0,"3,044,547",tt0468569,movie,N/A,"$534,987,076",N/A,N/A,True,
Batman Begins,2005,PG-13,15 Jun 2005,140 min,"Action, Crime, Drama",Christopher Nolan,"Bob Kane, David S. Goyer, Christopher Nolan","Christian Bale, Michael Caine, Ken Watanabe","After witnessing his parents' death, billionaire Bruce Wayne learns the art of fighting to confront injustice. When he returns to Gotham as Batman, he must stop a secret society that intends to destroy the city.","English, Mandarin","United States, United Kingdom",Nominated for 1 Oscar. 15 wins & 79 nominations total,https://m.media-amazon.com/images/M/MV5BODIyMDdhNTgtNDlmOC00MjUxLWE2NDItODA5MTdkNzY3ZTdhXkEyXkFqcGc@._V1_SX300.jpg,"[{'Source': 'Internet Movie Database', 'Value': '8.2/10'}, {'Source': 'Rotten Tomatoes', 'Value': '85%'}, {'Source': 'Metacritic', 'Value': '70/100'}]",70,8.2,"1,659,219",tt0372784,movie,N/A,"$206,863,479",N/A,N/A,True,
The Dark Knight Rises,2012,PG-13,20 Jul 2012,164 min,"Action, Crime, Drama",Christopher Nolan,"Jonathan Nolan, Christopher Nolan, David S. Goyer","Christian Bale, Tom Hardy, Anne Hathaway","Bane, an imposing terrorist, attacks Gotham City and disrupts its eight-year-long period of peace. This forces Bruce Wayne to come out of hiding and don the cape and cowl of Batman again.","English, Arabic","United States, United Kingdom",Nominated for 1 BAFTA Award45 wins & 103 nominations total,https://m.media-amazon.com/images/M/MV5BMTk4ODQzNDY3Ml5BMl5BanBnXkFtZTcwODA0NTM4Nw@@._V1_SX300.jpg,"[{'Source': 'Internet Movie Database', 'Value': '8.4/10'}, {'Source': 'Rotten Tomatoes', 'Value': '87%'}, {'Source': 'Metacritic', 'Value': '78/100'}]",78,8.4,"1,926,092",tt1345836,movie,N/A,"$448,149,584",N/A,N/A,True,
Joker,2019,R,04 Oct 2019,122 min,"Crime, Drama, Thriller",Todd Phillips,"Todd Phillips, Scott Silver, Bob Kane","Joaquin Phoenix, Robert De Niro, Zazie Beetz","Arthur Fleck, a party clown and a failed stand-up comedian, leads an impoverished life with his ailing mother. However, when society shuns him and brands him as a freak, he decides to embrace the life of chaos in Gotham City.","English, German","United States, Canada, Australia",Won 2 Oscars. 121 wins & 248 nominations total,https://m.media-amazon.com/images/M/MV5BNzY3OWQ5NDktNWQ2OC00ZjdlLThkMmItMDhhNDk3NTFiZGU4XkEyXkFqcGc@._V1_SX300.jpg,"[{'Source': 'Internet Movie Database', 'Value': '8.3/10'}, {'Source': 'Rotten Tomatoes', 'Value': '68%'}, {'Source': 'Metacritic', 'Value': '59/100'}]",59,8.3,"1,619,842",tt7286456,movie,N/A,"$335,477,657",N/A,N/A,True,
Avengers: Endgame,2019,PG-13,26 Apr 2019,181 min,"Action, Adventure, Sci-Fi","Anthony Russo, Joe Russo","Christopher Markus, Stephen McFeely, Stan Lee","Robert Downey Jr., Chris Evans, Mark Ruffalo","After the devastating events of Avengers: Infinity War (2018), the universe is in ruins. With the help of remaining allies, the Avengers assemble once more in order to reverse Thanos' actions and restore balance to the universe.","English, Japanese, Xhosa, German",United States,Nominated for 1 Oscar. 70 wins & 132 nominations total,https://m.media-amazon.com/images/M/MV5BMTc5MDE2ODcwNV5BMl5BanBnXkFtZTgwMzI2NzQ2NzM@._V1_SX300.jpg,"[{'Source': 'Internet Movie Database', 'Value': '8.4/10'}, {'Source': 'Rotten Tomatoes', 'Value': '94%'}, {'Source': 'Metacritic', 'Value': '78/100'}]",78,8.4,"1,373,635",tt4154796,movie,N/A,"$858,373,000",N/A,N/A,True,
Avengers: Infinity War,2018,PG-13,27 Apr 2018,149 min,"Action, Adventure, Sci-Fi","Anthony Russo, Joe Russo","Christopher Markus, Stephen McFeely, Stan Lee","Robert Downey Jr., Chris Hemsworth, Mark Ruffalo",The Avengers and their allies must be willing to sacrifice all in an attempt to defeat the powerful Thanos before his blitz of devastation and ruin puts an end to the universe.,English,"United States, Norway",Nominated for 1 Oscar. 48 wins & 80 nominations total,https://m.media-amazon.com/images/M/MV5BMjMxNjY2MDU1OV5BMl5BanBnXkFtZTgwNzY1MTUwNTM@._V1_SX300.jpg,"[{'Source': 'Internet Movie Database', 'Value': '8.4/10'}, {'Source': 'Rotten Tomatoes', 'Value': '85%'}, {'Source': 'Metacritic', 'Value': '68/100'}]",68,8.4,"1,301,790",tt4154756,movie,N/A,"$678,815,482",N/A,N/A,True,
The Avengers,2012,PG-13,04 May 2012,143 min,"Action, Sci-Fi",Joss Whedon,"Joss Whedon, Zak Penn","Robert Downey Jr., Chris Evans, Scarlett Johansson",Earth's mightiest heroes must come together and learn to fight as a team if they are going to stop the mischievous Loki and his alien army from enslaving humanity.,"English, Russian",United States,Nominated for 1 Oscar. 39 wins & 81 nominations total,https://m.media-amazon.com/images/M/MV5BNGE0YTVjNzUtNzJjOS00NGNlLTgxMzctZTY4YTE1Y2Y1ZTU4XkEyXkFqcGc@._V1_SX300.jpg,"[{'Source': 'Internet Movie Database', 'Value': '8.0/10'}, {'Source': 'Rotten Tomatoes', 'Value': '91%'}, {'Source': 'Metacritic', 'Value': '69/100'}]",69,8.0,"1,516,933",tt0848228,movie,N/A,"$623,357,910",N/A,N/A,True,
Avengers: Age of Ultron,2015,PG-13,01 May 2015,141 min,"Action, Adventure, Sci-Fi",Joss Whedon,"Joss Whedon, Stan Lee, Jack Kirby","Robert Downey Jr., Chris Evans, Mark Ruffalo","When Tony Stark and Bruce Banner try to jump-start a dormant peacekeeping program called Ultron, things go horribly wrong and it's up to Earth's mightiest heroes to stop the villainous Ultron from enacting his terrible plan.","English, Korean",United States,8 wins & 52 nominations total,https://m.media-amazon.com/images/M/MV5BODBhYTg1NGQtNGVmNS00ZTdiLThjYTYtZDFkNzRiNTZmNDZjXkEyXkFqcGc@._V1_SX300.jpg,"[{'Source': 'Internet Movie Database', 'Value': '7.3/10'}, {'Source': 'Rotten Tomatoes', 'Value': '76%'}, {'Source': 'Metacritic', 'Value': '66/100'}]",66,7.3,"968,174",tt2395427,movie,N/A,"$459,005,868",N/A,N/A,True,
Iron Man,2008,PG-13,02 May 2008,126 min,"Action, Adventure, Sci-Fi",Jon Favreau,"Mark Fergus, Hawk Ostby, Art Marcum","Robert Downey Jr., Gwyneth Paltrow, Terrence Howard","After being held captive in an Afghan cave, billionaire engineer Tony Stark creates a unique weaponized suit of armor to fight evil.","English, Persian, Urdu, Arabic, Kurdish, Hindi, Hungarian","United States, Canada",Nominated for 2 Oscars. 24 wins & 73 nominations total,https://m.media-amazon.com/images/M/MV5BMTczNTI2ODUwOF5BMl5BanBnXkFtZTcwMTU0NTIzMw@@._V1_SX300.jpg,"[{'Source': 'Internet Movie Database', 'Value': '7.9/10'}, {'Source': 'Rotten Tomatoes', 'Value': '94%'}, {'Source': 'Metacritic', 'Value': '79/100'}]",79,7.9,"1,183,300",tt0371746,movie,N/A,"$319,034,126",N/A,N/A,True,
Iron Man 2,2010,PG-13,07 May 2010,124 min,"Action, Sci-Fi",Jon Favreau,"Justin Theroux, Stan Lee, Don Heck","Robert Downey Jr., Mickey Rourke, Gwyneth Paltrow","With the world now aware of his identity as Iron Man, Tony Stark must contend with both his declining health and a vengeful mad man with ties to his father's legacy.","English, French, Russian",United States,Nominated for 1 Oscar. 7 wins & 45 nominations total,https://m.media-amazon.com/images/M/MV5BYWYyOGQzOGYtMGQ1My00ZWYxLTgzZjktZWYzN2IwYjkxYzM0XkEyXkFqcGc@._V1_SX300.jpg,"[{'Source': 'Internet Movie Database', 'Value': '6.9/10'}, {'Source': 'Rotten Tomatoes', 'Value': '72%'}, {'Source': 'Metacritic', 'Value': '57/100'}]",57,6.9,"909,600",tt1228705,movie,N/A,"$312,433,331",N/A,N/A,True,
Iron Man 3,2013,PG-13,03 May 2013,130 min,"Action, Adventure, Sci-Fi",Shane Black,"Drew Pearce, Shane Black, Stan Lee","Robert Downey Jr., Guy Pearce, Gwyneth Paltrow","When Tony Stark's world is torn apart by a formidable terrorist called the Mandarin, he starts an odyssey of rebuilding and retribution.",English,United States,Nominated for 1 Oscar. 20 wins & 63 nominations total,https://m.media-amazon.com/images/M/MV5BMjIzMzAzMjQyM15BMl5BanBnXkFtZTcwNzM2NjcyOQ@@._V1_SX300.jpg,"[{'Source': 'Internet Movie Database', 'Value': '7.1/10'}, {'Source': 'Rotten Tomatoes', 'Value': '79%'}, {'Source': 'Metacritic', 'Value': '62/100'}]",62,7.1,"937,973",tt1300854,movie,N/A,"$409,013,994",N/A,N/A,True,
Captain America: The First Avenger,2011,PG-13,22 Jul 2011,124 min,"Action, Adventure, Sci-Fi",Joe Johnston,"Christopher Markus, Stephen McFeely, Joe Simon","Chris Evans, Hugo Weaving, Samuel L. Jackson","Steve Rogers, a rejected military soldier, transforms into Captain America after taking a dose of a ""Super-Soldier serum"". But being Captain America comes at a price as he attempts to take down a warmonger and a terrorist organiza...","English, Norwegian, French",United States,4 wins & 50 nominations total,https://m.media-amazon.com/images/M/MV5BNzUyM2YyY2MtNzNlMS00MWU5LTgxNjAtNzZlNmI2NjU2NDZlXkEyXkFqcGc@._V1_SX300.jpg,"[{'Source': 'Internet Movie Database', 'Value': '6.9/10'}, {'Source': 'Rotten Tomatoes', 'Value': '80%'}, {'Source': 'Metacritic', 'Value': '66/100'}]",66,6.9,"936,774",tt0458339,movie,N/A,"$176,654,505",N/A,N/A,True,
Captain America: The Winter Soldier,2014,PG-13,04 Apr 2014,136 min,"Action, Adventure, Sci-Fi","Anthony Russo, Joe Russo","Christopher Markus, Stephen McFeely, Joe Simon","Chris Evans, Samuel L. Jackson, Scarlett Johansson","As Steve Rogers struggles to embrace his role in the modern world, he teams up with a fellow Avenger and S.H.I.E.L.D agent, Black Widow, to battle a new threat from history: an assassin known as the Winter Soldier.","English, French",United States,Nominated for 1 Oscar. 5 wins & 52 nominations total,https://m.media-amazon.com/images/M/MV5BNWY1NjFmNDItZDhmOC00NjI1LWE0ZDItMTM0MjBjZThiOTQ2XkEyXkFqcGc@._V1_SX300.jpg,"[{'Source': 'Internet Movie Database', 'Value': '7.7/10'}, {'Source': 'Rotten Tomatoes', 'Value': '90%'}, {'Source': 'Metacritic', 'Value': '70/100'}]",70,7.7,"942,182",tt1843866,movie,N/A,"$259,766,572",N/A,N/A,True,
Captain America: Civil War,2016,PG-13,06 May 2016,147 min,"Action, Sci-Fi","Anthony Russo, Joe Russo","Christopher Markus, Stephen McFeely, Joe Simon","Chris Evans, Robert Downey Jr., Scarlett Johansson",Political involvement in the Avengers' affairs causes a rift between Captain America and Iron Man.,"English, German, Xhosa, Russian, Romanian","United States, Germany, Puerto Rico",16 wins & 73 nominations total,https://m.media-amazon.com/images/M/MV5BMjQ0MTgyNjAxMV5BMl5BanBnXkFtZTgwNjUzMDkyODE@._V1_SX300.jpg,"[{'Source': 'Internet Movie Database', 'Value': '7.8/10'}, {'Source': 'Rotten Tomatoes', 'Value': '90%'}, {'Source': 'Metacritic', 'Value': '75/100'}]",75,7.8,"893,858",tt3498820,movie,N/A,"$408,084,349",N/A,N/A,True,
Black Panther,2018,PG-13,16 Feb 2018,134 min,"Action, Adventure, Sci-Fi",Ryan Coogler,"Ryan Coogler, Joe Robert Cole, Stan Lee","Chadwick Boseman, Michael B. Jordan, Lupita Nyong'o","T'Challa, heir to the hidden but advanced kingdom of Wakanda, must step forward to lead his people into a new future and must confront a challenger from his country's past.","English, Swahili, Nama, Xhosa, Korean",United States,Won 3 Oscars. 124 wins & 289 nominations total,https://m.media-amazon.com/images/M/MV5BMTg1MTY2MjYzNV5BMl5BanBnXkFtZTgwMTc4NTMwNDI@._V1_SX300.jpg,"[{'Source': 'Internet Movie Database', 'Value': '7.3/10'}, {'Source': 'Rotten Tomatoes', 'Value': '96%'}, {'Source': 'Metacritic', 'Value': '88/100'}]",88,7.3,"879,347",tt1825683,movie,N/A,"$700,426,566",N/A,N/A,True,
Doctor Strange,2016,PG-13,04 Nov 2016,115 min,"Action, Adventure, Fantasy",Scott Derrickson,"Jon Spaihts, Scott Derrickson, C. Robert Cargill","Benedict Cumberbatch, Chiwetel Ejiofor, Rachel McAdams","While on a journey of physical and spiritual healing, a brilliant neurosurgeon is drawn into the world of the mystic arts.",English,"United States, Hong Kong, Nepal",Nominated for 1 Oscar. 21 wins & 68 nominations total,https://m.media-amazon.com/images/M/MV5BNjgwNzAzNjk1Nl5BMl5BanBnXkFtZTgwMzQ2NjI1OTE@._V1_SX300.jpg,"[{'Source': 'Internet Movie Database', 'Value': '7.5/10'}, {'Source': 'Rotten Tomatoes', 'Value': '89%'}, {'Source': 'Metacritic', 'Value': '72/100'}]",72,7.5,"845,476",tt1211837,movie,N/A,"$232,641,920",N/A,N/A,True,
Thor,2011,PG-13,06 May 2011,115 min,"Action, Fantasy",Kenneth Branagh,"Ashley E. Miller, Zack Stentz, Don Payne","Chris Hemsworth, Anthony Hopkins, Natalie Portman","The powerful but arrogant god Thor is cast out of Asgard to live amongst humans in Midgard (Earth), where he soon becomes one of their finest defenders.",English,United States,5 wins & 30 nominations total,https://m.media-amazon.com/images/M/MV5BNjRhNGZjZjEtYTQzYS00OWUxLThjNGEtMTIwMTE2ZDFlZTZkXkEyXkFqcGc@._V1_SX300.jpg,"[{'Source': 'Internet Movie Database', 'Value': '7.0/10'}, {'Source': 'Rotten Tomatoes', 'Value': '77%'}, {'Source': 'Metacritic', 'Value': '57/100'}]",57,7.0,"936,720",tt0800369,movie,N/A,"$181,030,624",N/A,N/A,True,
Thor: Ragnarok,2017,PG-13,03 Nov 2017,130 min,"Action, Adventure, Comedy",Taika Waititi,"Eric Pearson, Craig Kyle, Christopher L. Yost","Chris Hemsworth, Tom Hiddleston, Cate Blanchett","Imprisoned on the planet Sakaar, Thor must race against time to return to Asgard and stop Ragnarök, the destruction of his world, at the hands of the powerful and ruthless villain Hela.",English,United States,6 wins & 50 nominations total,https://m.media-amazon.com/images/M/MV5BMjMyNDkzMzI1OF5BMl5BanBnXkFtZTgwODcxODg5MjI@._V1_SX300.jpg,"[{'Source': 'Internet Movie Database', 'Value': '7.9/10'}, {'Source': 'Rotten Tomatoes', 'Value': '93%'}, {'Source': 'Metacritic', 'Value': '74/100'}]",74,7.9,"863,772",tt3501632,movie,N/A,"$315,058,289",N/A,N/A,True,
Ant-Man,2015,PG-13,17 Jul 2015,117 min,"Action, Comedy, Sci-Fi",Peyton Reed,"Edgar Wright, Joe Cornish, Adam McKay","Paul Rudd, Michael Douglas, Corey Stoll","Armed with a super-suit with the astonishing ability to shrink in scale but increase in strength, cat burglar Scott Lang must embrace his inner hero and help his mentor, Dr. Hank Pym, pull off a plan that will save the world.",English,United States,Nominated for 1 BAFTA Award4 wins & 34 nominations total,https://m.media-amazon.com/images/M/MV5BMjM2NTQ5Mzc2M15BMl5BanBnXkFtZTgwNTcxMDI2NTE@._V1_SX300.jpg,"[{'Source': 'Internet Movie Database', 'Value': '7.2/10'}, {'Source': 'Rotten Tomatoes', 'Value': '83%'}, {'Source': 'Metacritic', 'Value': '64/100'}]",64,7.2,"757,549",tt0478970,movie,N/A,"$180,202,163",N/A,N/A,True,
Ant-Man and the Wasp,2018,PG-13,06 Jul 2018,118 min,"Action, Adventure, Comedy",Peyton Reed,"Chris McKenna, Erik Sommers, Paul Rudd","Paul Rudd, Evangeline Lilly, Michael Peña","As Scott Lang balances being both a superhero and a father, Hope van Dyne and Dr. Hank Pym present an urgent new mission that finds the Ant-Man fighting alongside The Wasp to uncover secrets from their past.","English, Spanish, French","United States, Canada",2 wins & 21 nominations total,https://m.media-amazon.com/images/M/MV5BODVkY2ZmZTAtYzFhMi00YzZlLWE2YWMtMDBiYjY2OTU4ZWM0XkEyXkFqcGc@._V1_SX300.jpg,"[{'Source': 'Internet Movie Database', 'Value': '7.0/10'}, {'Source': 'Rotten Tomatoes', 'Value': '87%'}, {'Source': 'Metacritic', 'Value': '70/100'}]",70,7.0,"477,652",tt5095030,movie,N/A,"$216,648,740",N/A,N/A,True,
Guardians of the Galaxy,2014,PG-13,01 Aug 2014,121 min,"Action, Adventure, Comedy",James Gunn,"James Gunn, Nicole Perlman, Dan Abnett","Chris Pratt, Vin Diesel, Bradley Cooper",A group of intergalactic criminals must pull together to stop a fanatical warrior with plans to purge the universe.,English,"United States, United Kingdom",Nominated for 2 Oscars. 52 wins & 103 nominations total,https://m.media-amazon.com/images/M/MV5BM2ZmNjQ2MzAtNDlhNi00MmQyLWJhZDMtNmJiMjFlOWY4MzcxXkEyXkFqcGc@._V1_SX300.jpg,"[{'Source': 'Internet Movie Database', 'Value': '8.0/10'}, {'Source': 'Rotten Tomatoes', 'Value': '92%'}, {'Source': 'Metacritic', 'Value': '76/100'}]",76,8.0,"1,325,843",tt2015381,movie,N/A,"$333,718,600",N/A,N/A,True,
Guardians of the Galaxy Vol. 2,2017,PG-13,05 May 2017,136 min,"Action, Adventure, Comedy",James Gunn,"James Gunn, Dan Abnett, Andy Lanning","Chris Pratt, Zoe Saldaña, Dave Bautista","The Guardians struggle to keep together as a team while dealing with their personal family issues, notably Star-Lord's encounter with his father, the ambitious celestial being Ego.",English,United States,Nominated for 1 Oscar. 15 wins & 60 nominations total,https://m.media-amazon.com/images/M/MV5BNWE5MGI3MDctMmU5Ni00YzI2LWEzMTQtZGIyZDA5MzQzNDBhXkEyXkFqcGc@._V1_SX300.jpg,"[{'Source': 'Internet Movie Database', 'Value': '7.6/10'}, {'Source': 'Rotten Tomatoes', 'Value': '85%'}, {'Source': 'Metacritic', 'Value': '67/100'}]",67,7.6,"802,014",tt3896198,movie,N/A,"$389,813,101",N/A,N/A,True,
Spider-Man: No Way Home,2021,PG-13,17 Dec 2021,148 min,"Action, Adventure, Fantasy",Jon Watts,"Chris McKenna, Erik Sommers, Stan Lee","Tom Holland, Zendaya, Benedict Cumberbatch","With Spider-Man's identity now revealed, Peter asks Doctor Strange for help. When a spell goes wrong, dangerous foes from other worlds start to appear.","English, Tagalog",United States,Nominated for 1 Oscar. 35 wins & 71 nominations total,https://m.media-amazon.com/images/M/MV5BMmFiZGZjMmEtMTA0Ni00MzA2LTljMTYtZGI2MGJmZWYzZTQ2XkEyXkFqcGc@._V1_SX300.jpg,"[{'Source': 'Internet Movie Database', 'Value': '8.2/10'}, {'Source': 'Rotten Tomatoes', 'Value': '93%'}, {'Source': 'Metacritic', 'Value': '71/100'}]",71,8.2,"958,084",tt10872600,movie,N/A,"$814,866,759",N/A,N/A,True,
The Matrix,1999,R,31 Mar 1999,136 min,"Action, Sci-Fi","Lana Wachowski, Lilly Wachowski","Lilly Wachowski, Lana Wachowski","Keanu Reeves, Laurence Fishburne, Carrie-Anne Moss","When a beautiful stranger leads computer hacker Neo to a forbidding underworld, he discovers the shocking truth--the life he knows is the elaborate deception of an evil cyber-intelligence.",English,"United States, Australia",Won 4 Oscars. 42 wins & 52 nominations total,https://m.media-amazon.com/images/M/MV5BN2NmN2VhMTQtMDNiOS00NDlhLTliMjgtODE2ZTY0ODQyNDRhXkEyXkFqcGc@._V1_SX300.jpg,"[{'Source': 'Internet Movie Database', 'Value': '8.7/10'}, {'Source': 'Rotten Tomatoes', 'Value': '83%'}, {'Source': 'Metacritic', 'Value': '73/100'}]",73,8.7,"2,170,119",tt0133093,movie,N/A,"$172,076,928",N/A,N/A,True,
Interstellar,2014,PG-13,07 Nov 2014,169 min,"Adventure, Drama, Sci-Fi",Christopher Nolan,"Jonathan Nolan, Christopher Nolan","Matthew McConaughey, Anne Hathaway, Jessica Chastain","When Earth becomes uninhabitable in the future, a farmer and ex-NASA pilot, Joseph Cooper, is tasked to pilot a spacecraft, along with a team of researchers, to find a new planet for humans.",English,"United States, United Kingdom, Canada",Won 1 Oscar. 44 wins & 148 nominations total,https://m.media-amazon.com/images/M/MV5BYzdjMDAxZGItMjI2My00ODA1LTlkNzItOWFjMDU5ZDJlYWY3XkEyXkFqcGc@._V1_SX300.jpg,"[{'Source': 'Internet Movie Database', 'Value': '8.7/10'}, {'Source': 'Rotten Tomatoes', 'Value': '73%'}, {'Source': 'Metacritic', 'Value': '74/100'}]",74,8.7,"2,375,214",tt0816692,movie,N/A,"$203,227,580",N/A,N/A,True,
Dunkirk,2017,PG-13,21 Jul 2017,106 min,"Action, Drama, History",Christopher Nolan,Christopher Nolan,"Fionn Whitehead, Barry Keoghan, Mark Rylance","Allied soldiers from Belgium, the British Commonwealth and Empire, and France are surrounded by the German Army and evacuated during a fierce battle in World War II.","English, French, German","United Kingdom, Netherlands, France, United States",Won 3 Oscars. 68 wins & 236 nominations total,https://m.media-amazon.com/images/M/MV5BZWU5ZjJkNTQtMzQwOS00ZGE4LWJkMWUtMGQ5YjdiM2FhYmRhXkEyXkFqcGc@._V1_SX300.jpg,"[{'Source': 'Internet Movie Database', 'Value': '7.8/10'}, {'Source': 'Rotten Tomatoes', 'Value': '92%'}, {'Source': 'Metacritic', 'Value': '94/100'}]",94,7.8,"776,380",tt5013056,movie,N/A,"$189,740,665",N/A,N/A,True,
Tenet,2020,PG-13,03 Sep 2020,150 min,"Action, Sci-Fi, Thriller",Christopher Nolan,Christopher Nolan,"John David Washington, Robert Pattinson, Elizabeth Debicki","Armed with only the word ""Tenet,"" and fighting for the survival of the entire world, CIA operative, The Protagonist, journeys through a twilight world of international espionage on a global mission that unfolds beyond real time.",English,"United States, United Kingdom",Won 1 Oscar. 49 wins & 139 nominations total,https://m.media-amazon.com/images/M/MV5BMTU0ZjZlYTUtYzIwMC00ZmQzLWEwZTAtZWFhMWIwYjMxY2I3XkEyXkFqcGc@._V1_SX300.jpg,"[{'Source': 'Internet Movie Database', 'Value': '7.3/10'}, {'Source': 'Rotten Tomatoes', 'Value': '70%'}, {'Source': 'Metacritic', 'Value': '69/100'}]",69,7.3,"629,814",tt6723592,movie,N/A,"$58,504,105",N/A,N/A,True,
Oppenheimer,2023,R,21 Jul 2023,180 min,"Biography, Drama, History",Christopher Nolan,"Christopher Nolan, Kai Bird, Martin Sherwin","Cillian Murphy, Emily Blunt, Matt Damon","A dramatization of the life story of J. Robert Oppenheimer, the physicist who had a large hand in the development of the atomic bombs that brought an end to World War II.","English, German, Italian, Dutch","United States, United Kingdom",Won 7 Oscars. 363 wins & 366 nominations total,https://m.media-amazon.com/images/M/MV5BN2JkMDc5MGQtZjg3YS00NmFiLWIyZmQtZTJmNTM5MjVmYTQ4XkEyXkFqcGc@._V1_SX300.jpg,"[{'Source': 'Internet Movie Database', 'Value': '8.3/10'}, {'Source': 'Rotten Tomatoes', 'Value': '93%'}, {'Source': 'Metacritic', 'Value': '90/100'}]",90,8.3,"915,198",tt15398776,movie,N/A,"$330,078,895",N/A,N/A,True,
Barbie,2023,PG-13,21 Jul 2023,114 min,"Adventure, Comedy, Fantasy",Greta Gerwig,"Greta Gerwig, Noah Baumbach","Margot Robbie, Ryan Gosling, Issa Rae","Barbie and Ken are having the time of their lives in the seemingly perfect world of Barbie Land. However, when they get a chance to go to the outside world, they soon discover the joys and perils of living among regular humans.","English, Spanish","United States, United Kingdom",Won 1 Oscar. 209 wins & 434 nominations total,https://m.media-amazon.com/images/M/MV5BYjI3NDU0ZGYtYjA2YS00Y2RlLTgwZDAtYTE2YTM5ZjE1M2JlXkEyXkFqcGc@._V1_SX300.jpg,"[{'Source': 'Internet Movie Database', 'Value': '6.8/10'}, {'Source': 'Rotten Tomatoes', 'Value': '88%'}, {'Source': 'Metacritic', 'Value': '80/100'}]",80,6.8,"617,252",tt1517268,movie,N/A,"$636,238,421",N/A,N/A,True,
