Title,Year,Rated,Released,Runtime,Genre,Director,Writer,Actors,Plot,Language,Country,Awards,Poster,Ratings,Metascore,imdbRating,imdbVotes,imdbID,Type,DVD,BoxOffice,Production,Website,Response,totalSeasons
The Hunger Games,2012,PG-13,23 Mar 2012,142 min,"Action, Adventure, Sci-Fi",Gary Ross,"Gary Ross, Suzanne Collins, Billy Ray","Jennifer Lawrence, Josh Hutcherson, Liam Hemsworth",Katniss Everdeen voluntarily takes her younger sister's place in the Hunger Games: a televised competition in which two teenagers from each of the twelve Districts of Panem are chosen at random to fight to the death.,English,United States,Won 1 BAFTA Award34 wins & 49 nominations total,https://m.media-amazon.com/images/M/MV5BMWI1OGM4YjQtNmIxNi00YmE2LWJkNTAtY2Q0YjU4NTI5NWQyXkEyXkFqcGc@._V1_SX300.jpg,"[{'Source': 'Internet Movie Database', 'Value': '7.2/10'}, {'Source': 'Rotten Tomatoes', 'Value': '84%'}, {'Source': 'Metacritic', 'Value': '68/100'}]",68,7.2,"1,050,244",tt1392170,movie,N/A,"$408,010,692",N/A,N/A,True,
Catching Fire,1989,N/A,N/A,23 min,"Short, Drama",Josef Steiff,Josef Steiff,N/A,N/A,English,United States,N/A,N/A,"[{'Source': 'Internet Movie Database', 'Value': '7.1/10'}]",N/A,7.1,113,tt1267161,movie,N/A,N/A,N/A,N/A,True,
The Mockingjay Lives: The Making of the Hunger Games: Mockingjay Part 1,2015,N/A,01 Feb 2015,134 min,Documentary,Jon Mefford,N/A,"Nina Jacobson, Jennifer Lawrence, Francis Lawrence, Josh Hutcherson","A behind-the-scenes look at the making of the blockbuster film, The Hunger Games: Mockingjay - Part 1.",English,USA,N/A,N/A,"[{'Source': 'Internet Movie Database', 'Value': '7.1/10'}]",N/A,7.1,39,tt4026144,movie,N/A,N/A,N/A,N/A,True,
Pawns No More: Making the Hunger Games: Mockingjay Part 2,2016,N/A,22 Mar 2016,142 min,Documentary,Jon Mefford,N/A,"Francis Lawrence, Josh Hutcherson, Nina Jacobson, David Levithan",This making of 'The Hunger Games: Mockingjay - Part 2 (2015)' is divided in 8 parts. Each part give an in depth view of one aspect of creating the movie. You can see how special effects ...,English,USA,N/A,https://m.media-amazon.com/images/M/MV5BMWJlOWNiMDMtZjk4MS00MjExLTlhNDktZWE1MjMyZmJlY2I0XkEyXkFqcGdeQXVyMzExMjM0Nw@@._V1_SX300.jpg,"[{'Source': 'Internet Movie Database', 'Value': '7.8/10'}]",N/A,7.8,16,tt5100692,movie,N/A,N/A,N/A,N/A,True,
The Maze Runner,2014,PG-13,19 Sep 2014,113 min,"Action, Mystery, Sci-Fi",Wes Ball,"Noah Oppenheim, Grant Pierce Myers, T.S. Nowlin","Dylan O'Brien, Kaya Scodelario, Will Poulter","Thomas is deposited in a community of boys after his memory is erased, soon learning they're all trapped in a maze that will require him to join forces with fellow ""runners"" for a shot at escape.",English,"United States, United Kingdom",4 wins & 12 nominations total,https://m.media-amazon.com/images/M/MV5BMjUyNTA3MTAyM15BMl5BanBnXkFtZTgwOTEyMTkyMjE@._V1_SX300.jpg,"[{'Source': 'Internet Movie Database', 'Value': '6.8/10'}, {'Source': 'Rotten Tomatoes', 'Value': '66%'}, {'Source': 'Metacritic', 'Value': '57/100'}]",57,6.8,"540,221",tt1790864,movie,N/A,"$102,427,862",N/A,N/A,True,
Divergent,2014,PG-13,21 Mar 2014,139 min,"Action, Adventure, Drama",Neil Burger,"Evan Daugherty, Vanessa Taylor, Veronica Roth","Shailene Woodley, Theo James, Kate Winslet","In a world divided by factions based on virtues, Tris learns she's Divergent and won't fit in. When she discovers a plot to destroy Divergents, Tris and the mysterious Four must find out what makes Divergents dangerous before it's...","English, Spanish",United States,7 wins & 11 nominations total,https://m.media-amazon.com/images/M/MV5BMTYxMzYwODE4OV5BMl5BanBnXkFtZTgwNDE5MzE2MDE@._V1_SX300.jpg,"[{'Source': 'Internet Movie Database', 'Value': '6.6/10'}, {'Source': 'Rotten Tomatoes', 'Value': '41%'}, {'Source': 'Metacritic', 'Value': '48/100'}]",48,6.6,"508,233",tt1840309,movie,N/A,"$150,947,895",N/A,N/A,True,
Insurgent,2015,PG-13,20 Mar 2015,119 min,"Action, Adventure, Sci-Fi",Robert Schwentke,"Brian Duffield, Akiva Goldsman, Mark Bomback","Shailene Woodley, Ansel Elgort, Theo James","Tris Prior must confront her inner demons, and with help from those closest to her, continue the fight against a powerful alliance that threatens to tear her society apart.",English,"United States, Canada",4 wins & 18 nominations total,https://m.media-amazon.com/images/M/MV5BMTgxOTYxMTg3OF5BMl5BanBnXkFtZTgwMDgyMzA2NDE@._V1_SX300.jpg,"[{'Source': 'Internet Movie Database', 'Value': '6.2/10'}, {'Source': 'Rotten Tomatoes', 'Value': '29%'}, {'Source': 'Metacritic', 'Value': '42/100'}]",42,6.2,"265,711",tt2908446,movie,N/A,"$130,179,072",N/A,N/A,True,
Allegiant,2016,PG-13,18 Mar 2016,120 min,"Action, Adventure, Fantasy",Robert Schwentke,"Noah Oppenheim, Adam Cooper, Bill Collage","Shailene Woodley, Theo James, Jeff Daniels","After the earth-shattering revelations of Insurgent, Tris must escape with Four beyond the wall that encircles Chicago to finally discover the shocking truth of the world outside.",English,United States,3 wins & 12 nominations total,https://m.media-amazon.com/images/M/MV5BMzZlYzZlNDktMDAxMS00OGZiLThkYzAtNWEzNDliYjAyZmM5XkEyXkFqcGc@._V1_SX300.jpg,"[{'Source': 'Internet Movie Database', 'Value': '5.7/10'}, {'Source': 'Rotten Tomatoes', 'Value': '11%'}, {'Source': 'Metacritic', 'Value': '33/100'}]",33,5.7,"142,018",tt3410834,movie,N/A,"$66,184,051",N/A,N/A,True,
Twilight,2008,PG-13,21 Nov 2008,122 min,"Drama, Fantasy, Romance",Catherine Hardwicke,"Melissa Rosenberg, Stephenie Meyer","Kristen Stewart, Robert Pattinson, Billy Burke","When Bella Swan moves to a small town in the Pacific Northwest, she falls in love with Edward Cullen, a mysterious classmate who reveals himself to be a 108-year-old vampire.",English,"United States, United Kingdom",34 wins & 16 nominations total,https://m.media-amazon.com/images/M/MV5BMTQ2NzUxMTAxN15BMl5BanBnXkFtZTcwMzEyMTIwMg@@._V1_SX300.jpg,"[{'Source': 'Internet Movie Database', 'Value': '5.3/10'}, {'Source': 'Rotten Tomatoes', 'Value': '48%'}, {'Source': 'Metacritic', 'Value': '56/100'}]",56,5.3,"508,464",tt1099212,movie,N/A,"$193,962,473",N/A,N/A,True,
New Moon,1940,Approved,28 Jun 1940,105 min,"Adventure, Musical, Romance","Robert Z. Leonard, W.S. Van Dyke","Oscar Hammerstein II, Frank Mandel, Laurence Schwab","Jeanette MacDonald, Nelson Eddy, Mary Boland","On a Louisiana-bound ship, a nobleman planning a campaign for liberty encounters an heiress.",English,United States,N/A,https://m.media-amazon.com/images/M/MV5BMTYzNjcwNDQ5M15BMl5BanBnXkFtZTgwMjY5NTY3MzE@._V1_SX300.jpg,"[{'Source': 'Internet Movie Database', 'Value': '6.7/10'}]",N/A,6.7,641,tt0032840,movie,N/A,N/A,N/A,N/A,True,
Eclipse,2021–,N/A,24 Jun 2021,2 min,"Action, Drama, History",N/A,Shailendra Jha,"Zoya Hussain, Wamiqa Gabbi, Anshuman Pushkar",It's 1984 - a tender love story succumbs to the anti-Sikh riots. It's 2016 - IPS officer Amrita Singh uncovers a secret connecting that past to her present.,Hindi,India,1 win & 19 nominations,https://m.media-amazon.com/images/M/MV5BZGM3OTBhOTQtOTAyMi00YzVhLTk2NjMtNTUzOGFlNDU5ZTc4XkEyXkFqcGc@._V1_SX300.jpg,"[{'Source': 'Internet Movie Database', 'Value': '8.3/10'}]",N/A,8.3,"7,911",tt14820482,series,,,,,True,1
The Twilight Saga: Making of Breaking Dawn Part 1,2012,N/A,11 Feb 2012,N/A,Documentary,N/A,N/A,"Robert Pattinson, Kristen Stewart",N/A,English,USA,N/A,N/A,"[{'Source': 'Internet Movie Database', 'Value': '7.7/10'}]",N/A,7.7,29,tt2406370,movie,N/A,N/A,N/A,N/A,True,
Forever: Filming Breaking Dawn Part 2,2013,N/A,02 Mar 2013,95 min,Documentary,N/A,N/A,N/A,N/A,English,USA,N/A,N/A,[],N/A,N/A,N/A,tt2923548,movie,N/A,N/A,N/A,N/A,True,
The Notebook,2004,PG-13,25 Jun 2004,123 min,"Drama, Romance",Nick Cassavetes,"Jeremy Leven, Jan Sardi, Nicholas Sparks","Gena Rowlands, James Garner, Rachel McAdams",An elderly man reads to a woman with dementia the story of two young lovers whose romance is threatened by the difference in their respective social classes.,English,United States,12 wins & 10 nominations total,https://m.media-amazon.com/images/M/MV5BZjE0ZjgzMzYtMTAxYi00NGMzLThmZDktNzFlMzA2MWRmYWQ0XkEyXkFqcGc@._V1_SX300.jpg,"[{'Source': 'Internet Movie Database', 'Value': '7.8/10'}, {'Source': 'Rotten Tomatoes', 'Value': '54%'}, {'Source': 'Metacritic', 'Value': '53/100'}]",53,7.8,"660,714",tt0332280,movie,N/A,"$81,417,274",N/A,N/A,True,
A Walk to Remember,2002,PG,25 Jan 2002,101 min,"Drama, Romance",Adam Shankman,"Nicholas Sparks, Karen Janszen","Mandy Moore, Shane West, Peter Coyote","Two North Carolina teens, Landon Carter and Jamie Sullivan, are thrown together after Landon gets into trouble and is sentenced to perform community service.",English,United States,4 wins & 2 nominations total,https://m.media-amazon.com/images/M/MV5BYjkxZWE0YjMtYTk2OS00ZmFjLTk2YjEtY2M3MGY4MzE4MGNkXkEyXkFqcGc@._V1_SX300.jpg,"[{'Source': 'Internet Movie Database', 'Value': '7.3/10'}, {'Source': 'Rotten Tomatoes', 'Value': '30%'}, {'Source': 'Metacritic', 'Value': '35/100'}]",35,7.3,"227,751",tt0281358,movie,N/A,"$41,281,092",N/A,N/A,True,
The Fault in Our Stars,2014,PG-13,06 Jun 2014,126 min,"Drama, Romance",Josh Boone,"Scott Neustadter, Michael H. Weber, John Green","Shailene Woodley, Ansel Elgort, Nat Wolff","Hazel and Gus are teenagers who meet at a cancer support group and fall in love. They both share the same acerbic wit and a love of books, especially ""An Imperial Affliction"", so they embark on a journey to visit an author in Amst...",English,United States,23 wins & 18 nominations total,https://m.media-amazon.com/images/M/MV5BYTA4ODg5YWUtYmZiYy00Y2M4LWE0NjEtODE5MzhkYmJmZGEwXkEyXkFqcGc@._V1_SX300.jpg,"[{'Source': 'Internet Movie Database', 'Value': '7.6/10'}, {'Source': 'Rotten Tomatoes', 'Value': '81%'}, {'Source': 'Metacritic', 'Value': '69/100'}]",69,7.6,"415,886",tt2582846,movie,N/A,"$124,872,350",N/A,N/A,True,
La La Land,2016,PG-13,25 Dec 2016,128 min,"Comedy, Drama, Music",Damien Chazelle,Damien Chazelle,"Ryan Gosling, Emma Stone, Rosemarie DeWitt","When Sebastian, a pianist, and Mia, an actress, follow their passion and achieve success in their respective fields, they find themselves torn between their love for each other and their careers.","English, Cantonese","United States, Hong Kong",Won 6 Oscars. 242 wins & 307 nominations total,https://m.media-amazon.com/images/M/MV5BMzUzNDM2NzM2MV5BMl5BanBnXkFtZTgwNTM3NTg4OTE@._V1_SX300.jpg,"[{'Source': 'Internet Movie Database', 'Value': '8.0/10'}, {'Source': 'Rotten Tomatoes', 'Value': '91%'}, {'Source': 'Metacritic', 'Value': '94/100'}]",94,8.0,"717,993",tt3783958,movie,N/A,"$151,101,803",N/A,N/A,True,
Whiplash,2014,R,15 Oct 2014,106 min,"Drama, Music",Damien Chazelle,Damien Chazelle,"Miles Teller, J.K. Simmons, Melissa Benoist",A promising young drummer enrolls at a cut-throat music conservatory where his dreams of greatness are mentored by an instructor who will stop at nothing to realize a student's potential.,English,United States,Won 3 Oscars. 99 wins & 144 nominations total,https://m.media-amazon.com/images/M/MV5BMDFjOWFkYzktYzhhMC00NmYyLTkwY2EtYjViMDhmNzg0OGFkXkEyXkFqcGc@._V1_SX300.jpg,"[{'Source': 'Internet Movie Database', 'Value': '8.5/10'}, {'Source': 'Rotten Tomatoes', 'Value': '94%'}, {'Source': 'Metacritic', 'Value': '89/100'}]",89,8.5,"1,086,388",tt2582802,movie,N/A,"$14,003,391",N/A,N/A,True,
Everything Everywhere All at Once,2022,R,08 Apr 2022,139 min,"Action, Adventure, Comedy","Daniel Kwan, Daniel Scheinert","Daniel Kwan, Daniel Scheinert","Michelle Yeoh, Stephanie Hsu, Jamie Lee Curtis",A middle-aged Chinese immigrant is swept up into an insane adventure in which she alone can save existence by exploring other universes and connecting with the lives she could have led.,"English, Mandarin, Cantonese",United States,Won 7 Oscars. 397 wins & 379 nominations total,https://m.media-amazon.com/images/M/MV5BOWNmMzAzZmQtNDQ1NC00Nzk5LTkyMmUtNGI2N2NkOWM4MzEyXkEyXkFqcGc@._V1_SX300.jpg,"[{'Source': 'Internet Movie Database', 'Value': '7.8/10'}, {'Source': 'Rotten Tomatoes', 'Value': '94%'}, {'Source': 'Metacritic', 'Value': '81/100'}]",81,7.8,"586,472",tt6710474,movie,N/A,"$77,191,785",N/A,N/A,True,
Parasite,2019,R,08 Nov 2019,132 min,"Drama, Thriller",Bong Joon Ho,"Bong Joon Ho, Han Jin-won","Song Kang-ho, Lee Sun-kyun, Cho Yeo-jeong",Greed and class discrimination threaten the newly formed symbiotic relationship between the wealthy Park family and the destitute Kim clan.,"Korean, English",South Korea,Won 4 Oscars. 309 wins & 260 nominations total,https://m.media-amazon.com/images/M/MV5BYjk1Y2U4MjQtY2ZiNS00OWQyLWI3MmYtZWUwNmRjYWRiNWNhXkEyXkFqcGc@._V1_SX300.jpg,"[{'Source': 'Internet Movie Database', 'Value': '8.5/10'}, {'Source': 'Rotten Tomatoes', 'Value': '99%'}, {'Source': 'Metacritic', 'Value': '97/100'}]",97,8.5,"1,079,711",tt6751668,movie,N/A,"$53,847,897",N/A,N/A,True,
1917,2019,R,10 Jan 2020,119 min,"Action, Drama, War",Sam Mendes,"Sam Mendes, Krysty Wilson-Cairns","Dean-Charles Chapman, George MacKay, Daniel Mays","April 6th, 1917. As an infantry battalion assembles to wage war deep in enemy territory, two soldiers are assigned to race against time and deliver a message that will stop 1,600 men from walking straight into a deadly trap.","English, French, German","United Kingdom, United States, India, Spain, Canada",Won 3 Oscars. 135 wins & 200 nominations total,https://m.media-amazon.com/images/M/MV5BYzkxZjg2NDQtMGVjMy00NWZkLTk0ZDEtZWE3NDYwYjAyMTg1XkEyXkFqcGc@._V1_SX300.jpg,"[{'Source': 'Internet Movie Database', 'Value': '8.2/10'}, {'Source': 'Rotten Tomatoes', 'Value': '88%'}, {'Source': 'Metacritic', 'Value': '78/100'}]",78,8.2,"735,870",tt8579674,movie,N/A,"$159,227,644",N/A,N/A,True,
No Country for Old Men,2007,R,21 Nov 2007,122 min,"Crime, Drama, Thriller","Ethan Coen, Joel Coen","Joel Coen, Ethan Coen, Cormac McCarthy","Tommy Lee Jones, Javier Bardem, Josh Brolin",Violence and mayhem ensue after a hunter stumbles upon the aftermath of a drug deal gone wrong and over two million dollars in cash near the Rio Grande.,"English, Spanish",United States,Won 4 Oscars. 165 wins & 139 nominations total,https://m.media-amazon.com/images/M/MV5BMjA5Njk3MjM4OV5BMl5BanBnXkFtZTcwMTc5MTE1MQ@@._V1_SX300.jpg,"[{'Source': 'Internet Movie Database', 'Value': '8.2/10'}, {'Source': 'Rotten Tomatoes', 'Value': '93%'}, {'Source': 'Metacritic', 'Value': '92/100'}]",92,8.2,"1,128,602",tt0477348,movie,N/A,"$74,283,625",N/A,N/A,True,
There Will Be Blood,2007,R,25 Jan 2008,158 min,Drama,Paul Thomas Anderson,"Paul Thomas Anderson, Upton Sinclair","Daniel Day-Lewis, Paul Dano, Ciarán Hinds","A story of family, religion, hatred, oil and madness, focusing on a turn-of-the-century prospector in the early days of the business.","English, American Sign ",United States,Won 2 Oscars. 114 wins & 138 nominations total,https://m.media-amazon.com/images/M/MV5BMjAxODQ4MDU5NV5BMl5BanBnXkFtZTcwMDU4MjU1MQ@@._V1_SX300.jpg,"[{'Source': 'Internet Movie Database', 'Value': '8.2/10'}, {'Source': 'Rotten Tomatoes', 'Value': '91%'}, {'Source': 'Metacritic', 'Value': '93/100'}]",93,8.2,"674,063",tt0469494,movie,N/A,"$40,222,514",N/A,N/A,True,
Her,2013,R,10 Jan 2014,126 min,"Drama, Romance, Sci-Fi",Spike Jonze,Spike Jonze,"Joaquin Phoenix, Amy Adams, Scarlett Johansson","In the near future, a lonely writer develops an unlikely relationship with an operating system designed to meet his every need.",English,United States,Won 1 Oscar. 83 wins & 187 nominations total,https://m.media-amazon.com/images/M/MV5BMjA1Nzk0OTM2OF5BMl5BanBnXkFtZTgwNjU2NjEwMDE@._V1_SX300.jpg,"[{'Source': 'Internet Movie Database', 'Value': '8.0/10'}, {'Source': 'Rotten Tomatoes', 'Value': '95%'}, {'Source': 'Metacritic', 'Value': '91/100'}]",91,8.0,"704,150",tt1798709,movie,N/A,"$25,568,251",N/A,N/A,True,
Ex Machina,2014,R,24 Apr 2015,108 min,"Drama, Sci-Fi, Thriller",Alex Garland,Alex Garland,"Alicia Vikander, Domhnall Gleeson, Oscar Isaac",A young programmer is selected to participate in a ground-breaking experiment in synthetic intelligence by evaluating the human qualities of a highly advanced humanoid A.I.,English,"United Kingdom, United States",Won 1 Oscar. 74 wins & 162 nominations total,https://m.media-amazon.com/images/M/MV5BMTUxNzc0OTIxMV5BMl5BanBnXkFtZTgwNDI3NzU2NDE@._V1_SX300.jpg,"[{'Source': 'Internet Movie Database', 'Value': '7.7/10'}, {'Source': 'Rotten Tomatoes', 'Value': '92%'}, {'Source': 'Metacritic', 'Value': '78/100'}]",78,7.7,"619,108",tt0470752,movie,N/A,"$25,442,958",N/A,N/A,True,
The Whale,2022,R,21 Dec 2022,117 min,Drama,Darren Aronofsky,Samuel D. Hunter,"Brendan Fraser, Sadie Sink, Ty Simpkins","A reclusive, morbidly obese English teacher attempts to reconnect with his estranged teenage daughter.",English,United States,Won 2 Oscars. 50 wins & 122 nominations total,https://m.media-amazon.com/images/M/MV5BYmNhOWMyNTYtNTljNC00NTU3LWFiYmQtMDBhOGU5NWFhNGU5XkEyXkFqcGc@._V1_SX300.jpg,"[{'Source': 'Internet Movie Database', 'Value': '7.6/10'}, {'Source': 'Rotten Tomatoes', 'Value': '64%'}, {'Source': 'Metacritic', 'Value': '60/100'}]",60,7.6,"238,269",tt13833688,movie,N/A,"$17,463,630",N/A,N/A,True,
The Revenant,2015,R,08 Jan 2016,156 min,"Adventure, Drama, Western",Alejandro G. Iñárritu,"Mark L. Smith, Alejandro G. Iñárritu, Michael Punke","Leonardo DiCaprio, Tom Hardy, Will Poulter",A frontiersman on a fur trading expedition in the 1820s fights for survival after being mauled by a bear and left for dead by members of his own hunting team.,"English, Pawnee, French","United States, Hong Kong, Taiwan, Argentina",Won 3 Oscars. 94 wins & 193 nominations total,https://m.media-amazon.com/images/M/MV5BYTgwNmQzZDctMjNmOS00OTExLTkwM2UtNzJmOTJhODFjOTdlXkEyXkFqcGc@._V1_SX300.jpg,"[{'Source': 'Internet Movie Database', 'Value': '8.0/10'}, {'Source': 'Rotten Tomatoes', 'Value': '78%'}, {'Source': 'Metacritic', 'Value': '76/100'}]",76,8.0,"916,939",tt1663202,movie,N/A,"$183,637,894",N/A,N/A,True,
Birdman,1967–1987,TV-G,09 Sep 1967,30 min,"Animation, Action, Adventure",N/A,N/A,"Keith Andes, Don Messick, John Stephenson",A winged superhero who gets his powers from the sun battles various evildoers with the help of his eagle sidekick Avenger.,English,United States,N/A,https://m.media-amazon.com/images/M/MV5BMzg5OGI3MTUtMDJlZC00OWRlLWIyMzktMjcyN2MxYzQ4NDFjXkEyXkFqcGc@._V1_SX300.jpg,"[{'Source': 'Internet Movie Database', 'Value': '6.7/10'}]",N/A,6.7,"1,135",tt0061237,series,,,,,True,1
Gravity,2013,PG-13,04 Oct 2013,91 min,"Drama, Sci-Fi, Thriller",Alfonso Cuarón,"Alfonso Cuarón, Jonás Cuarón","Sandra Bullock, George Clooney, Ed Harris","Dr Ryan Stone, an engineer on her first space mission, and Matt Kowalski, an astronaut on his final expedition, have to survive in space after they are hit by debris while spacewalking.","English, Greenlandic","United Kingdom, United States",Won 7 Oscars. 240 wins & 188 nominations total,https://m.media-amazon.com/images/M/MV5BNjE5MzYwMzYxMF5BMl5BanBnXkFtZTcwOTk4MTk0OQ@@._V1_SX300.jpg,"[{'Source': 'Internet Movie Database', 'Value': '7.7/10'}, {'Source': 'Rotten Tomatoes', 'Value': '96%'}, {'Source': 'Metacritic', 'Value': '96/100'}]",96,7.7,"883,511",tt1454468,movie,N/A,"$274,092,705",N/A,N/A,True,
Roma,2018,R,14 Dec 2018,135 min,Drama,Alfonso Cuarón,Alfonso Cuarón,"Yalitza Aparicio, Marina de Tavira, Diego Cortina Autrey",A year in the life of a upper-middle-class family's maid in Mexico City in the early 1970s.,"Spanish, Mixtec, English, Japanese, German, French, Norwegian","Mexico, United States",Won 3 Oscars. 257 wins & 232 nominations total,https://m.media-amazon.com/images/M/MV5BMTU0OTc3ODk4Ml5BMl5BanBnXkFtZTgwMzM4NzI5NjM@._V1_SX300.jpg,"[{'Source': 'Internet Movie Database', 'Value': '7.7/10'}, {'Source': 'Rotten Tomatoes', 'Value': '96%'}, {'Source': 'Metacritic', 'Value': '96/100'}]",96,7.7,"174,192",tt6155172,movie,N/A,N/A,N/A,N/A,True,
Breaking Bad,2008–2013,TV-MA,20 Jan 2008,49 min,"Crime, Drama, Thriller",N/A,Vince Gilligan,"Bryan Cranston, Aaron Paul, Anna Gunn",A chemistry teacher diagnosed with inoperable lung cancer turns to manufacturing and selling methamphetamine with a former student to secure his family's future.,"English, Spanish",United States,Won 16 Primetime Emmys. 169 wins & 269 nominations total,https://m.media-amazon.com/images/M/MV5BMzU5ZGYzNmQtMTdhYy00OGRiLTg0NmQtYjVjNzliZTg1ZGE4XkEyXkFqcGc@._V1_SX300.jpg,"[{'Source': 'Internet Movie Database', 'Value': '9.5/10'}, {'Source': 'Rotten Tomatoes', 'Value': '96%'}]",N/A,9.5,"2,364,489",tt0903747,series,,,,,True,5
Better Call Saul,2015–2022,TV-MA,08 Feb 2015,46 min,"Crime, Drama",N/A,"Vince Gilligan, Peter Gould","Bob Odenkirk, Rhea Seehorn, Jonathan Banks",The trials and tribulations of criminal lawyer Jimmy McGill in the years leading up to his fateful run-in with Walter White and Jesse Pinkman.,"English, Spanish, Vietnamese",United States,Nominated for 53 Primetime Emmys. 66 wins & 317 nominations total,https://m.media-amazon.com/images/M/MV5BNDdjNTEzMjMtYjM3Mi00NzQ3LWFlNWMtZjdmYWU3ZDkzMjk1XkEyXkFqcGc@._V1_SX300.jpg,"[{'Source': 'Internet Movie Database', 'Value': '9.0/10'}]",N/A,9.0,"746,923",tt3032476,series,,,,,True,6
Stranger Things,2016–2025,TV-14,15 Jul 2016,51 min,"Drama, Fantasy, Horror",N/A,"Matt Duffer, Ross Duffer","Millie Bobby Brown, Finn Wolfhard, Winona Ryder","In 1980s Indiana, a group of young friends witness supernatural forces and secret government exploits. As they search for answers, the children unravel a series of extraordinary mysteries.",English,United States,Won 12 Primetime Emmys. 113 wins & 309 nominations total,https://m.media-amazon.com/images/M/MV5BMjg2NmM0MTEtYWY2Yy00NmFlLTllNTMtMjVkZjEwMGVlNzdjXkEyXkFqcGc@._V1_SX300.jpg,"[{'Source': 'Internet Movie Database', 'Value': '8.6/10'}]",N/A,8.6,"1,456,880",tt4574334,series,,,,,True,5
Game of Thrones,2011–2019,TV-MA,17 Apr 2011,57 min,"Action, Adventure, Drama",N/A,"David Benioff, D.B. Weiss","Emilia Clarke, Peter Dinklage, Kit Harington","Nine noble families fight for control over the lands of Westeros, while an ancient enemy returns after being dormant for millennia.",English,"United States, United Kingdom",Won 59 Primetime Emmys. 395 wins & 655 nominations total,https://m.media-amazon.com/images/M/MV5BMTNhMDJmNmYtNDQ5OS00ODdlLWE0ZDAtZTgyYTIwNDY3OTU3XkEyXkFqcGc@._V1_SX300.jpg,"[{'Source': 'Internet Movie Database', 'Value': '9.2/10'}]",N/A,9.2,"2,457,210",tt0944947,series,,,,,True,8
House of the Dragon,2022–,TV-MA,21 Aug 2022,N/A,"Action, Adventure, Drama",N/A,"Ryan J. Condal, George R.R. Martin","Matt Smith, Emma D'Arcy, Olivia Cooke","An internal succession war within House Targaryen at the height of its power, 172 years before the birth of Daenerys Targaryen.",English,United States,Won 1 Primetime Emmy. 19 wins & 90 nominations total,https://m.media-amazon.com/images/M/MV5BM2QzMGVkNjUtN2Y4Yi00ODMwLTg3YzktYzUxYjJlNjFjNDY1XkEyXkFqcGc@._V1_SX300.jpg,"[{'Source': 'Internet Movie Database', 'Value': '8.3/10'}]",N/A,8.3,"483,315",tt11198330,series,,,,,True,4
The Sopranos,1999–2007,TV-MA,10 Jan 1999,55 min,"Crime, Drama",N/A,David Chase,"James Gandolfini, Lorraine Bracco, Edie Falco","New Jersey mob boss Tony Soprano deals with personal and professional issues in his home and business life that affect his mental state, leading him to seek professional psychiatric counseling.","English, Italian, Russian",United States,Won 21 Primetime Emmys. 126 wins & 312 nominations total,https://m.media-amazon.com/images/M/MV5BMjRmMTNiMTQtMDg1ZS00MGM1LWE1MGUtYjEzMGFjNWUzOWRkXkEyXkFqcGc@._V1_SX300.jpg,"[{'Source': 'Internet Movie Database', 'Value': '9.2/10'}]",N/A,9.2,"534,565",tt0141842,series,,,,,True,6
The Wire,2002–2008,TV-MA,02 Jun 2002,59 min,"Crime, Drama, Thriller",N/A,David Simon,"Dominic West, Lance Reddick, Sonja Sohn","The Baltimore drug scene, as seen through the eyes of drug dealers and law enforcement.","English, Greek, Mandarin, Spanish",United States,Nominated for 2 Primetime Emmys. 16 wins & 59 nominations total,https://m.media-amazon.com/images/M/MV5BZWYyNmRhYjktNjBhNC00M2NhLWEzYmMtZDYwNmIyZTRiZWMzXkEyXkFqcGc@._V1_SX300.jpg,"[{'Source': 'Internet Movie Database', 'Value': '9.3/10'}]",N/A,9.3,"405,267",tt0306414,series,,,,,True,5
Friends,1994–2004,TV-14,22 Sep 1994,22 min,"Comedy, Romance",N/A,"David Crane, Marta Kauffman","Jennifer Aniston, Courteney Cox, Lisa Kudrow",Follows the personal and professional lives of six twenty to thirty year-old friends living in the Manhattan borough of New York City.,"English, Spanish, Italian, French, Dutch, Hebrew",United States,Won 6 Primetime Emmys. 79 wins & 231 nominations total,https://m.media-amazon.com/images/M/MV5BOTU2YmM5ZjctOGVlMC00YTczLTljM2MtYjhlNGI5YWMyZjFkXkEyXkFqcGc@._V1_SX300.jpg,"[{'Source': 'Internet Movie Database', 'Value': '8.9/10'}]",N/A,8.9,"1,152,885",tt0108778,series,,,,,True,10
The Office,2005–2013,TV-14,24 Mar 2005,22 min,Comedy,N/A,"Greg Daniels, Ricky Gervais, Stephen Merchant","Steve Carell, Jenna Fischer, John Krasinski","A mockumentary on a group of typical office workers, where the workday consists of ego clashes, inappropriate behavior, tedium and romance.","English, Spanish, German, French",United States,Won 5 Primetime Emmys. 59 wins & 211 nominations total,https://m.media-amazon.com/images/M/MV5BZjQwYzBlYzUtZjhhOS00ZDQ0LWE0NzAtYTk4MjgzZTNkZWEzXkEyXkFqcGc@._V1_SX300.jpg,"[{'Source': 'Internet Movie Database', 'Value': '9.0/10'}]",N/A,9.0,"783,728",tt0386676,series,,,,,True,9
Parks and Recreation,2009–2015,TV-14,09 Apr 2009,22 min,Comedy,N/A,"Greg Daniels, Michael Schur","Amy Poehler, Jim O'Heir, Nick Offerman",The absurd antics of an Indiana town's public officials as they pursue sundry projects to make their city a better place.,English,United States,Nominated for 14 Primetime Emmys. 36 wins & 182 nominations total,https://m.media-amazon.com/images/M/MV5BNDlhMzAwNTAtNTk2NS00MTdkLWE3ZWYtMDU0MTFiYmU2ZTc0XkEyXkFqcGc@._V1_SX300.jpg,"[{'Source': 'Internet Movie Database', 'Value': '8.6/10'}]",N/A,8.6,"305,089",tt1266020,series,,,,,True,7
